Air Sandwich,https://isaacphysics.org/questions/air_sandwich_sym,,,N,Physics,3,Waves,Superposition,,,3,N,N,Y,Y,Y,N,N,"Reflection and Refraction, Superposition","11u. Trigonometry, 12u. Cosecant, 16u. Compound Angles, 17u. Double Angles",
Diffraction in Paraffin,https://isaacphysics.org/questions/diffraction_in_paraffin,,,N,Physics,3,Waves,Superposition,,,1,N,N,Y,N,Y,Y,N,"Diffraction, Electromagnetic Waves, Standing Waves, Waves","11u. Trigonometry, 12u. Cosecant, 16u. Compound Angles, 17u. Double Angles",
Don't Bragg,https://isaacphysics.org/questions/don't_bragg,,,N,Physics,3,Waves,Superposition,,,5,Y,Y,Y,N,Y,Y,N,"Path and Phase Difference, Photoelectric Effect (Quantisation)","1u. Exponentials, 25u. Differentiation , 2u. Logarithms, 3u. Functions",
Don't Bragg,https://isaacphysics.org/questions/don't_bragg_sym,,,N,Physics,3,Waves,Superposition,,,5,N,N,Y,Y,Y,Y,N,"Superposition, Photoelectric Effect (Quantisation)","11u. Trigonometry, 19u.Vectors , 20u. Vector Equations, 21u. Scalar Product , 22u. Vectors & Geometry ",
Grating Spectrum,https://isaacphysics.org/questions/grating_spectrum,,,N,Physics,3,Waves,Superposition,,,4,N,N,Y,N,Y,N,N,"Diffraction, Electromagnetic Waves","26u. Integration, 2u. Logarithms, 34u. Standard Forms , 37u. First Order ODEs , 38u. General Modelling , 4u. Modulus",
Microscope Slide,https://isaacphysics.org/questions/microscope_slide,,,N,Physics,3,Waves,Superposition,,,2,N,N,Y,N,Y,N,Y,"Refractive Index, Constructive and Destructive Interference","25u. Differentiation , 28u. Implicit Curves , 29u. Parametrics , 32u. Quotients , 3u. Functions",
Modified Double Slit,https://isaacphysics.org/questions/modified_double_slit,,,N,Physics,3,Waves,Superposition,,,2,N,Y,Y,N,Y,Y,Y,"Diffraction, Reflection and Refraction, Superposition","11u. Trigonometry, 26u. Integration, 27u. Calculus with Trig , 2u. Logarithms, 34u. Standard Forms ",
Cosmic Reflection,https://isaacphysics.org/questions/reflecting_on_the_cosmos,,,N,Physics,3,Waves,Superposition,,,1,N,N,Y,N,Y,Y,Y,"Reflection and Refraction, Superposition (Constructive and Destructive Interference)","23u. Rational Functions, 24u. Binomial Expansions, 3u. Functions, 4u. Modulus, 7u. Numerical Solutions",
Smoothness Test,https://isaacphysics.org/questions/smoothness_test,,,N,Physics,3,Waves,Superposition,,,2,N,N,Y,N,Y,Y,Y,"Reflection and Refraction, Superposition","10u. Algebraic Division, 1u. Exponentials, 23u. Rational Functions, 26u. Integration, 2u. Logarithms, 34u. Standard Forms , 37u. First Order ODEs , 4u. Modulus",
Splitting Hairs,https://isaacphysics.org/questions/splitting_hairs,,,N,Physics,3,Waves,Superposition,,,1,N,N,Y,N,Y,Y,Y,Diffraction,"10. Inequalities, 13. Finding Roots, 14. Simultaneous Equations, 16. Curve sketching, 17. Transformations, 19. Circles, 21. Cosine, 23. Trig Identities 2, 24. Angles and Geometry, 28. Trigonometric Identities",
Thin Film Colour,https://isaacphysics.org/questions/thin_film_colour,,,N,Physics,3,Waves,Superposition,,,5,Y,Y,Y,N,Y,N,N,"Reflection and Refraction, Superposition, The Electromagnetic Spectrum","A Binary Star System, Fields in a Triangle, Space Missions and Lagrangian Points, The Cavendish Experiment, Two Orbiting Masses",
Two Material Interferometer,https://isaacphysics.org/questions/two_material_phase,,,N,Physics,3,Waves,Superposition,,,1,N,N,Y,N,Y,N,N,"Refractive Index, Superposition","A Particle Current, Electron in a Magnetic Field, Force on a Wire, Wire Between Magnets",
Cliff Reflection,https://isaacphysics.org/questions/cliff_reflection,,,N,Physics,1,Waves,Wave Motion,,,1,N,N,Y,N,Y,Y,N,"Incidence and Reflection, Waves","A Particle Current, Electron in a Magnetic Field, Force on a Wire, Wire Between Magnets",
Echo Location,https://isaacphysics.org/questions/echo_location,,,N,Physics,1,Waves,Wave Motion,,,1,N,Y,N,N,Y,N,N,"Incidence and Reflection, Waves",,
Finding Frequency,https://isaacphysics.org/questions/finding_frequency,,,N,Physics,1,Waves,Wave Motion,,,1,N,Y,N,N,Y,N,N,Waves (Concepts),,
Finding Wave Speed,https://isaacphysics.org/questions/finding_wavespeed,,,N,Physics,1,Waves,Wave Motion,,,1,N,N,Y,N,Y,N,N,Waves,,
How Fast?,https://isaacphysics.org/questions/how_fast,,,N,Physics,1,Waves,Wave Motion,,,1,N,N,Y,N,Y,N,N,Waves,,
Noise Production,https://isaacphysics.org/questions/noise_production,,,N,Physics,1,Waves,Wave Motion,,,4,N,Y,Y,N,Y,N,N,Types of Waves,,
Ripple Tank,https://isaacphysics.org/questions/ripple_tank,,,N,Physics,1,Waves,Wave Motion,,,2,N,Y,Y,N,Y,N,N,Types of Waves,,
Ship in a Bath,https://isaacphysics.org/questions/ripple_tank_new,,,N,Physics,1,Waves,Wave Motion,,,2,N,Y,Y,N,Y,N,N,Types of Waves,,
Sound Profile,https://isaacphysics.org/questions/sound_profile,,,N,Physics,1,Waves,Wave Motion,,,2,N,Y,Y,N,Y,N,N,Waves,,
Two Microphones,https://isaacphysics.org/questions/two_microphones,,,N,Physics,1,Waves,Wave Motion,,,1,N,N,Y,N,Y,Y,Y,Waves,,
Waves at Sea,https://isaacphysics.org/questions/waves_at_sea,,,N,Physics,1,Waves,Wave Motion,,,2,N,N,Y,N,Y,Y,N,Refractive Index,,
Break Free,https://isaacphysics.org/questions/break_free,,,N,Physics,2,Waves,Wave Motion,,,3,N,Y,Y,N,Y,N,N,Waves,,
Passing Siren,https://isaacphysics.org/questions/doppler_siren_driving_past,,,N,Physics,2,Waves,Wave Motion,,,1,N,N,Y,N,Y,N,N,Doppler Effect,,
Electron Beam,https://isaacphysics.org/questions/electron_beam,,,N,Physics,2,Waves,Wave Motion,,,2,N,N,Y,N,Y,Y,N,"Electrical Cell, Linear Kinetic Energy, De Broglie Wavelength",,
Light Has the Power,https://isaacphysics.org/questions/light_has_the_power,,,N,Physics,2,Waves,Wave Motion,,,1,N,Y,N,N,Y,N,N,Snell's Law,,
Redirecting Waves,https://isaacphysics.org/questions/redirecting_waves,,,N,Physics,2,Waves,Wave Motion,,,3,N,Y,Y,N,Y,Y,Y,Snell's Law,,
Travelling vs. Standing,https://isaacphysics.org/questions/travelling_vs_standing,,,N,Physics,2,Waves,Wave Motion,,,1,N,Y,N,N,Y,N,N,"Standing Types of Waves, Waves",,
Wave Direction,https://isaacphysics.org/questions/waveforms,,,N,Physics,2,Waves,Wave Motion,,,1,N,Y,N,N,Y,Y,N,Waves,,
Waves on a Beach,https://isaacphysics.org/questions/waves_on_a_beach,,,N,Physics,2,Waves,Wave Motion,,,1,N,Y,N,N,Y,Y,Y,"Trigonometric Relationships, Waves",,
Waving Along,https://isaacphysics.org/questions/waving_along,,,N,Physics,2,Waves,Wave Motion,,,3,N,Y,Y,N,Y,Y,N,"Dimensional Analysis, Waves (Concepts)",,
X-ray Production,https://isaacphysics.org/questions/x_ray_production,,,N,Physics,2,Waves,Wave Motion,,,2,N,N,Y,N,Y,Y,Y,"Conservation of Energy, Electromagnetic Waves",,
Underwater Ridge,https://isaacphysics.org/questions/underwater_ridge,Y,,N,Physics,3,Waves,Wave Motion,,,2,N,N,Y,N,Y,Y,Y,Total Internal Reflection,,
Underwater ridge,https://isaacphysics.org/questions/underwater_ridge_sym,,,N,Physics,3,Waves,Wave Motion,,,2,N,N,N,Y,Y,Y,Y,Total Internal Reflection,,
Amplitude Modulation,https://isaacphysics.org/questions/amplitude_modulation,,,N,Physics,3,Waves,Wave Motion,,,3,N,N,Y,N,Y,Y,N,"Electromagnetic Waves, Waves",,
Conical Wavefront,https://isaacphysics.org/questions/conical_wavefront,,,N,Physics,3,Waves,Wave Motion,,,2,N,N,Y,N,Y,Y,Y,Waves,,
Conveying the Doppler Effect,https://isaacphysics.org/questions/conveying_the_doppler_effect,,,N,Physics,3,Waves,Wave Motion,,,2,N,Y,Y,N,Y,N,Y,"Doppler Effect, Relative Velocity",,
Decibels,https://isaacphysics.org/questions/decibels,,,N,Physics,3,Waves,Wave Motion,,,1,N,N,Y,N,Y,N,N,Waves,,
Flying in Circles,https://isaacphysics.org/questions/doppler_model_aircraft,,,N,Physics,3,Waves,Wave Motion,,,3,N,Y,Y,N,Y,Y,Y,Doppler Effect,,
Speed Camera,https://isaacphysics.org/questions/law_enforcement,,,N,Physics,3,Waves,Wave Motion,,,1,N,N,Y,N,Y,Y,N,"Doppler Effect, Superposition (Beats)",,
Light Pressure,https://isaacphysics.org/questions/light_pressure,,,N,Physics,3,Waves,Wave Motion,,,2,N,Y,Y,N,Y,Y,Y,"Electromagnetic De Broglie Wavelength, Force, Newton's Third Law of Motion, Waves",,
Light Up A Mirror,https://isaacphysics.org/questions/lighting_up_a_mirror,,,N,Physics,3,Waves,Wave Motion,,,1,N,N,Y,N,Y,Y,Y,"Incidence and Reflection, Waves",,
Singing Bottles,https://isaacphysics.org/questions/singing_bottles,,,N,Physics,3,Waves,Wave Motion,,,6,Y,N,Y,N,Y,N,Y,"Doppler Effect, Standing Waves, Superposition (Beats)",,
1. Three Coplanar Forces,https://isaacphysics.org/questions/ft_mechanics_lower_1,,,Y,Physics,1,,,,,3,N,Y,Y,N,N,N,N,,,
10. Ring on a String,https://isaacphysics.org/questions/ft_mechanics_lower_10,,,Y,Physics,1,,,,,3,Y,N,Y,N,N,N,N,,,
11. Mass and Pulley,https://isaacphysics.org/questions/ft_mechanics_lower_11,,,Y,Physics,1,,,,,3,Y,N,Y,N,N,N,N,,,
12. Building Site Hoist,https://isaacphysics.org/questions/ft_mechanics_lower_12,,,Y,Physics,1,,,,,4,N,N,Y,N,N,N,N,,,
13. A  Particle,https://isaacphysics.org/questions/ft_mechanics_lower_13,,,Y,Physics,1,,,,,3,N,N,Y,N,N,N,N,,"Firing a Cannonball, Relative Velocity",
14. Accelerating Car,https://isaacphysics.org/questions/ft_mechanics_lower_14,,,Y,Physics,1,,,,,4,Y,Y,Y,N,N,N,N,,"A Ball Thrown Off a Cliff , A Stone's Flight",
15. 2 Uniform Rods,https://isaacphysics.org/questions/ft_mechanics_lower_15,,,Y,Physics,1,,,,,2,N,N,Y,N,N,N,N,,,
16. Collision,https://isaacphysics.org/questions/ft_mechanics_lower_16,,,Y,Physics,1,,,,,5,Y,Y,Y,N,N,N,N,,,
2. Slipping Block,https://isaacphysics.org/questions/ft_mechanics_lower_2,,,Y,Physics,1,,,,,3,N,N,Y,N,N,N,N,,"A Diode Divider, Alternating RC Circuit, An Oscillating Capacitor, Characteristic Time for Capacitors, Diode Truth Tables, Discharging Capacitor, Potentiometer Circuit with Capacitor, Resistor for LED Circuit, Slowing Down A Bomb, Square Pulse, Two Cs and Three Rs",
3. Car on a Horizontal Road,https://isaacphysics.org/questions/ft_mechanics_lower_3,,,Y,Physics,1,,,,,3,N,N,Y,N,N,N,N,,"Capacitor & Diode Rectifier, Discharging Capacitor, Square Pulse, Square Wave Charging",
4. Three Forces,https://isaacphysics.org/questions/ft_mechanics_lower_4,,,Y,Physics,1,,,,,4,N,N,Y,N,N,N,N,,"An Oscillating Capacitor, Capacitor & Diode Rectifier, Square Pulse, Square Wave Charging",
5. Perpendicular Forces,https://isaacphysics.org/questions/ft_mechanics_lower_5,,,Y,Physics,1,,,,,4,N,N,Y,N,N,N,N,,"A Devious Diode, A Diode Divider, Diode Truth Tables, Two Transformers",
6. Forces in Equilibrium,https://isaacphysics.org/questions/ft_mechanics_lower_6,,,Y,Physics,1,,,,,2,N,N,Y,N,N,N,N,,"A Fuse Problem, Body Resistance, Making Bulbs Brighter, Old Light Bulbs, Which Fuse to Use",
7. Block on a Rough Surface,https://isaacphysics.org/questions/ft_mechanics_lower_7,,,Y,Physics,1,,,,,2,N,N,Y,N,N,N,N,,"A Diode Divider, Heating an Electric Fire, Lighting a Lamp, Range of Related Resistors",
8. Man in a Lift,https://isaacphysics.org/questions/ft_mechanics_lower_8,,,Y,Physics,1,,,,,1,N,N,Y,N,N,N,N,,"Current between Resistors, Meter Measurements, Resistors with Tolerance, Vital Voltmeters, Voltage Measurement",
9. The Train,https://isaacphysics.org/questions/ft_mechanics_lower_9,,,Y,Physics,1,,,,,5,N,N,Y,N,N,N,N,,"Current and Resistance, Measuring Resistances, Point of No Return, Voltage Measurement",
1. Three Forces,https://isaacphysics.org/questions/ft_mechanics_upper_1,,,Y,Physics,2,,,,,4,N,N,Y,N,N,N,N,,"Current and Resistance, Measuring Resistances, Point of No Return, Voltage Measurement",
10. Two Particles on a Pulley,https://isaacphysics.org/questions/ft_mechanics_upper_10,,,Y,Physics,2,,,,,7,Y,N,Y,N,N,N,N,,"Destroying the Moon, Launching a Rocket, Spinning on a Table, The Spouting Can",
11. Loading Parcels,https://isaacphysics.org/questions/ft_mechanics_upper_11,,,Y,Physics,2,,,,,3,N,N,Y,N,N,N,N,,"A Coiled Rope, Destroying the Moon, Loop the Loop",
12. Particles Colliding on a Plane,https://isaacphysics.org/questions/ft_mechanics_upper_12,,,Y,Physics,2,,,,,5,Y,N,Y,N,N,N,N,,"Lifting a Rod, Space Monster Attack, Spinning up a Hard Drive",
13. Projectile,https://isaacphysics.org/questions/ft_mechanics_upper_13,,,Y,Physics,2,,,,,3,N,N,Y,N,N,N,N,," Two Spinning Balls, A Simple Pendulum, Hammer Throwing",
14. Particle Travelling in Straight Line,https://isaacphysics.org/questions/ft_mechanics_upper_14,,,Y,Physics,2,,,,,3,N,N,Y,N,N,N,N,," A Particle in a Bowl, Hanging a Non-uniform Bar, Moments of Inertia",
15. Uniform Solid Cone,https://isaacphysics.org/questions/ft_mechanics_upper_15,,,Y,Physics,2,,,,,2,N,N,Y,N,N,N,N,,"A Particle in a Circle, A Simple Pendulum, Angular Velocity of the Collapsed Sun, Old Fashioned Record",
16. 2 Particle Collision,https://isaacphysics.org/questions/ft_mechanics_upper_16,,,Y,Physics,2,,,,,2,N,N,Y,N,N,N,N,," Conical Pendulum, A Diatomic Molecule, Angular vs. Linear Motion",
2. A Box on a Plane,https://isaacphysics.org/questions/ft_mechanics_upper_2,,,Y,Physics,2,,,,,4,N,N,Y,N,N,N,N,,"Accuracy of an SHM Approximation, Loop the Loop, Sphere Versus Cylinder, Work Done by a Wheel",
3. Air Resistance on Particles,https://isaacphysics.org/questions/ft_mechanics_upper_3,,,Y,Physics,2,,,,,3,Y,N,Y,N,N,N,N,,"Moments of Inertia, Planetary Gun, Rolling Race, Rolling Sphere vs. Cylinder",
4. Projecting a Particle,https://isaacphysics.org/questions/ft_mechanics_upper_4,,,Y,Physics,2,,,,,5,N,N,Y,N,N,N,N,,"Destroying the Moon, Moments of Inertia, Transfer of Energy in Collisions",
5. A Particle and a Ring,https://isaacphysics.org/questions/ft_mechanics_upper_5,,,Y,Physics,2,,,,,4,Y,N,Y,N,N,N,N,,"Careless Astronauts, Loop the Loop, Transfer of Energy in Collisions",
6. A Ring on a String,https://isaacphysics.org/questions/ft_mechanics_upper_6,,,Y,Physics,2,,,,,5,Y,N,Y,N,N,N,N,,"Careless Astronauts, Destroying the Moon, Inelastic and Elastic Collisions",
7. A Car and a Trailer,https://isaacphysics.org/questions/ft_mechanics_upper_7,,,Y,Physics,2,,,,,2,N,N,Y,N,N,N,N,,"A Ballistic Pendulum, Loop the Loop, Rolling Sphere vs. Cylinder, The Spouting Can",
8. A Furniture Van,https://isaacphysics.org/questions/ft_mechanics_upper_8,,,Y,Physics,2,,,,,2,N,N,Y,N,N,N,N,,"Braking a Car, Building a Tennis Court, Rotational Tug of War",
9. Three Particles on a Pulley,https://isaacphysics.org/questions/ft_mechanics_upper_9,,,Y,Physics,2,,,,,4,N,N,Y,N,N,N,N,,"Braking a Car, Building a Tennis Court, Rotational Tug of War",
1. Two Cyclists,https://isaacphysics.org/questions/ft_mechanics_core_1,,,Y,Physics,3,,,,,3,Y,N,Y,N,N,N,N,,"A Ballistic Pendulum, A Spinning Ice-skater, Destroying the Moon, Test of Strength",
2. A Car and Trailer,https://isaacphysics.org/questions/ft_mechanics_core_2,,,Y,Physics,3,,,,,5,N,N,Y,N,Y,N,N,,"Angular Velocity of the Collapsed Sun, Spinning Bungee",
3. Two Rings,https://isaacphysics.org/questions/ft_mechanics_core_3,,,Y,Physics,3,,,,,3,N,N,Y,N,N,N,N,,"Angular Velocity of the Collapsed Sun, Spinning Bungee",
4. Sliding Blocks,https://isaacphysics.org/questions/ft_mechanics_core_4,,,Y,Physics,3,,,,,4,N,N,Y,N,N,N,N,," Two Spinning Balls, A Simple Pendulum, A Spinning Ice-skater, Angular Rod and Mass",
5. A Pulley,https://isaacphysics.org/questions/ft_mechanics_core_5,,,Y,Physics,3,,,,,6,N,N,Y,N,N,N,N,,"A Ballistic Pendulum, A Spinning Ice-skater, Moments of Inertia, Rolling Race",
6. A Board in Equilibrium,https://isaacphysics.org/questions/ft_mechanics_core_6,,,Y,Physics,3,,,,,3,N,N,Y,N,N,N,N,,"A Diatomic Molecule, Dropping a Mass on a Windmill, Rotating Targets at the Funfair, Work Done in a Circle",
7. Projected Ball on a Ramp,https://isaacphysics.org/questions/ft_mechanics_core_7,,,Y,Physics,3,,,,,4,N,Y,Y,N,N,N,N,,"Rolling Race, Rolling Sphere vs. Cylinder",
8. The Model Train,https://isaacphysics.org/questions/ft_mechanics_core_8,,,Y,Physics,3,,,,,6,Y,Y,Y,N,Y,N,N,,"Exploring Astronaut, Flying off the Earth, Satellite Firing Rockets, Semicircular Paths, Two Orbiting Masses",
B2 Adding Vectors,https://isaacphysics.org/questions/ch_b_p2,,Physics A-Level,N,Physics,,,,Adding Vectors,https://isaacphysics.org/gameboards#adding_vectors,12,N,N,Y,N,N,N,N,," A Particle in a Bowl, Hammer Throwing, Stuck in the Mud",
F4 Centripetal Acceleration,https://isaacphysics.org/questions/ch_f_p4,,Physics A-Level,N,Physics,,,,Centripetal acceleration,https://isaacphysics.org/gameboards#centripetal_acceleration,11,N,Y,Y,N,N,N,N,,"A Spinning Ice-skater, Freefall to the Moon, Planetary Gun, Simple Transfer Orbit",
F3 Units of Rotary Motion,https://isaacphysics.org/questions/ch_f_p3,,Physics A-Level,N,Physics,,,,Circular Motion,https://isaacphysics.org/gameboards#circular_motion,20,N,N,Y,N,N,N,N,,"A Spinning Ice-skater, Freefall to the Moon, Freefall to the Moon, Simple Transfer Orbit, Speed in an elliptical orbit",
B3 Uniform Accelerated Motion in One Dimension,https://isaacphysics.org/questions/ch_b_p3,,Physics A-Level,N,Physics,,,,Equations of Motion - 1D,https://isaacphysics.org/gameboards#equations_motion_1d,11,N,N,Y,N,N,N,N,,"A Simple Pendulum, Accuracy of an SHM Approximation, Circular Pendulum, Moments of Inertia, Swinging Rod, T Shaped Pendulum, Two Mass Pendulum",
B4 Trajectories,https://isaacphysics.org/questions/ch_b_p4,,Physics A-Level,N,Physics,,,,Equations of Motion - 2D,https://isaacphysics.org/gameboards#eqns_motion_2d,15,N,N,Y,N,N,N,N,,"Loop the Loop, Moment of Inertia of 2 Particles, Moments of Inertia, T Shaped Pendulum",
F1 Force and Momentum,https://isaacphysics.org/questions/ch_f_p1,,Physics A-Level,N,Physics,,,,Force and Momentum,https://isaacphysics.org/gameboards#force_momentum,10,N,N,Y,N,N,N,N,,"Kepler's Third Law, Speed in an elliptical orbit, Time to Reach A Star",
F6 Gravity and Orbits,https://isaacphysics.org/questions/ch_f_p6,,Physics A-Level,N,Physics,,,,Gravity & Orbits,https://isaacphysics.org/gameboards#gravity_orbits,8,Y,N,Y,N,N,N,N,,A Binary Star System,
B5 Moments,https://isaacphysics.org/questions/ch_b_p5,,Physics A-Level,N,Physics,,,,Moments,https://isaacphysics.org/gameboards#moments,10,N,Y,Y,N,N,N,N,,"A Simple Pendulum, Braking a Car, How Long is a Space Ruler?, Rotational Tug of War",
F2 Conservation of Momentum,https://isaacphysics.org/questions/ch_f_p2,,Physics A-Level,N,Physics,,,,Momentum and collisions,https://isaacphysics.org/gameboards#momentum_collisions,10,N,N,Y,N,N,N,N,,"Rotational Tug of War, Test of Strength, The Bouncing Ball",
F7 Oscillators,https://isaacphysics.org/questions/ch_f_p7,,Physics A-Level,N,Physics,,,,SHM,https://isaacphysics.org/gameboards#shm,10,N,N,Y,N,N,N,N,,,
"B9 Energy, Springs and Materials",https://isaacphysics.org/questions/ch_b_p9,,Physics A-Level,N,Physics,,,,Springs,https://isaacphysics.org/gameboards#springs,8,N,N,Y,N,N,N,N,,,
B1 Components of a Vector,https://isaacphysics.org/questions/ch_b_p1,,Physics A-Level,N,Physics,,,,Vectors components,https://isaacphysics.org/gameboards#vector_components,10,N,N,Y,N,N,N,N,,,
"B8 Work, Energy and Power",https://isaacphysics.org/questions/ch_b_p8,,Physics A-Level,N,Physics,,,,Work Energy and Power,https://isaacphysics.org/gameboards#work_energy_power,12,N,N,Y,N,N,N,N,,,
A1 Using & Rearranging Equations,https://isaacphysics.org/questions/ch_a_p1,,Physics A-Level,N,Physics,,,,,,12,N,N,Y,N,N,N,N,,,
A2 Derived and Base SI Units,https://isaacphysics.org/questions/ch_a_p2,,Physics A-Level,N,Physics,,,,,,37,N,Y,Y,N,N,N,N,,,
A3 Standard Form and Prefixes,https://isaacphysics.org/questions/ch_a_p3,,Physics A-Level,N,Physics,,,,,,12,N,Y,Y,N,N,N,N,,,
A4 Converting Units,https://isaacphysics.org/questions/ch_a_p4,,Physics A-Level,N,Physics,,,,,,11,N,N,Y,N,N,N,N,,"Bond Enthalpies, Bonds in Carbon Dioxide, Discovering Phosphorus",
A5 Gradients and Intercepts of Graphs,https://isaacphysics.org/questions/ch_a_p5,,Physics A-Level,N,Physics,,,,,,10,N,N,Y,N,N,N,N,,"Bonds in Carbon Dioxide, Discovering Phosphorus, Water Vaporisation",
A6 Equations of Graphs,https://isaacphysics.org/questions/ch_a_p6,,Physics A-Level,N,Physics,,,,,,14,N,Y,N,N,N,N,N,,"Conductivity, Lighting a Lamp, Making Bulbs Brighter, Non-linear I-V",
A7 Area Under the Line on a Graph,https://isaacphysics.org/questions/ch_a_p7,,Physics A-Level,N,Physics,,,,,,5,N,Y,Y,N,N,N,N,,,
A8 Area Under the Line on a Graph,https://isaacphysics.org/questions/ch_a_p8,,Physics A-Level,N,Physics,,,,,,5,N,N,Y,N,N,N,N,,,
"B6 Stress, Strain and Young's modulus",https://isaacphysics.org/questions/ch_b_p6,,Physics A-Level,N,Physics,,,,,,21,N,N,Y,N,N,N,N,,,
B7 Springs,https://isaacphysics.org/questions/ch_b_p7,,Physics A-Level,N,Physics,,,,,,14,N,Y,Y,N,N,N,N,,,
C1 Combinations of Resistors,https://isaacphysics.org/questions/ch_c_p1,,Physics A-Level,N,Physics,,,,,,12,N,N,Y,N,N,N,N,,,
C2 Charge Carriers,https://isaacphysics.org/questions/ch_c_p2,,Physics A-Level,N,Physics,,,,,,10,N,N,Y,N,N,N,N,,,
C3 Charge Carriers II,https://isaacphysics.org/questions/ch_c_p3,,Physics A-Level,N,Physics,,,,,,12,N,Y,Y,N,N,N,N,,,
C4 Kirchhoff's Laws,https://isaacphysics.org/questions/ch_c_p4,,Physics A-Level,N,Physics,,,,,,17,N,N,Y,N,N,N,N,,,
C5 Potential Dividers,https://isaacphysics.org/questions/ch_c_p5,,Physics A-Level,N,Physics,,,,,,14,N,Y,Y,N,N,N,N,,,
C6 Internal Resistance,https://isaacphysics.org/questions/ch_c_p6,,Physics A-Level,N,Physics,,,,,,11,N,N,Y,N,N,N,N,,,
D1 Amplitude and Intensity,https://isaacphysics.org/questions/ch_d_p1,,Physics A-Level,N,Physics,,,,,,10,N,Y,Y,N,N,N,N,,,
D2 Polarisation,https://isaacphysics.org/questions/ch_d_p2,,Physics A-Level,N,Physics,,,,,,14,N,N,Y,N,N,N,N,,,
D3 Path Difference,https://isaacphysics.org/questions/ch_d_p3,,Physics A-Level,N,Physics,,,,,,20,N,Y,Y,N,N,N,N,,,
D4 Interference,https://isaacphysics.org/questions/ch_d_p4,,Physics A-Level,N,Physics,,,,,,12,N,N,Y,N,N,N,N,,,
D5 Standing Waves,https://isaacphysics.org/questions/ch_d_p5,,Physics A-Level,N,Physics,,,,,,16,N,Y,Y,N,N,N,N,,,
D6 The Photoelectric Effect,https://isaacphysics.org/questions/ch_d_p6,,Physics A-Level,N,Physics,,,,,,16,N,Y,Y,N,N,N,N,,,
D7 Quantum Calculations,https://isaacphysics.org/questions/ch_d_p7,,Physics A-Level,N,Physics,,,,,,19,N,Y,Y,N,N,N,N,,,
D8 Refraction and Total Internal Reflection,https://isaacphysics.org/questions/ch_d_p8,,Physics A-Level,N,Physics,,,,,,22,N,N,Y,N,N,N,N,,,
E1 Absolute Uncertainties,https://isaacphysics.org/questions/ch_e_p1,,Physics A-Level,N,Physics,,,,,,17,N,Y,Y,N,N,N,N,,The Lifeguard ,
E2 Relative uncertainties,https://isaacphysics.org/questions/ch_e_p2,,Physics A-Level,N,Physics,,,,,,12,N,Y,Y,N,N,N,N,,,
E3 Propagating uncertainties,https://isaacphysics.org/questions/ch_e_p3,,Physics A-Level,N,Physics,,,,,,10,N,Y,Y,N,N,N,N,,,
"E4 Accuracy, Percentage Difference and Reliability",https://isaacphysics.org/questions/ch_e_p4,,Physics A-Level,N,Physics,,,,,,9,N,Y,Y,N,N,N,N,,,
F5 Newtonian Gravity,https://isaacphysics.org/questions/ch_f_p5,,Physics A-Level,N,Physics,,,,,,8,N,N,Y,N,N,N,N,,,
G1 Kelvin Scale of Temperature,https://isaacphysics.org/questions/ch_g_p1,,Physics A-Level,N,Physics,,,,,,8,N,N,Y,N,N,N,N,,,
G2 Gas Laws,https://isaacphysics.org/questions/ch_g_p2,,Physics A-Level,N,Physics,,,,,,10,N,N,Y,N,N,N,N,,,
G3 Heat Capacity,https://isaacphysics.org/questions/ch_g_p3,,Physics A-Level,N,Physics,,,,,,13,N,N,Y,N,N,N,N,,,
G4 Latent Heat and Heat Capacity,https://isaacphysics.org/questions/ch_g_p4,,Physics A-Level,N,Physics,,,,,,12,N,N,Y,N,N,N,N,,,
H1 Uniform Electric Fields,https://isaacphysics.org/questions/ch_h_p1,,Physics A-Level,N,Physics,,,,,,10,N,Y,Y,N,N,N,N,,,
H2 Electric Field Near Point Charges,https://isaacphysics.org/questions/ch_h_p2,,Physics A-Level,N,Physics,,,,,,10,N,N,Y,N,N,N,N,,,
H3 Speed of an Electron in an Electric Field,https://isaacphysics.org/questions/ch_h_p3,,Physics A-Level,N,Physics,,,,,,10,N,Y,Y,N,N,N,N,,,
H4 Force on a Conductor in a Magnetic Field,https://isaacphysics.org/questions/ch_h_p4,,Physics A-Level,N,Physics,,,,,,10,N,Y,Y,N,N,N,N,,,
H5 Force on a Particle in a Magnetic Field,https://isaacphysics.org/questions/ch_h_p5,,Physics A-Level,N,Physics,,,,,,6,N,N,Y,N,N,N,N,,,
H6 Circular Paths of Particles in Magnetic Fields,https://isaacphysics.org/questions/ch_h_p6,,Physics A-Level,N,Physics,,,,,,8,N,N,Y,N,N,N,N,,,
H7 Magnetic Flux and Faraday's Law,https://isaacphysics.org/questions/ch_h_p7,,Physics A-Level,N,Physics,,,,,,12,N,N,Y,N,N,N,N,,,
H8 Transformers,https://isaacphysics.org/questions/ch_h_p8,,Physics A-Level,N,Physics,,,,,,15,N,Y,Y,N,N,N,N,,,
I2 Capacitor Networks,https://isaacphysics.org/questions/ch_i_p2,,Physics A-Level,N,Physics,,,,,,10,N,N,Y,N,N,N,N,,,
I3 Discharge of a Capacitor,https://isaacphysics.org/questions/ch_i_p3,,Physics A-Level,N,Physics,,,,,,20,Y,N,Y,N,N,N,N,,,
J1 Nuclear Equations,https://isaacphysics.org/questions/ch_j_p1,,Physics A-Level,N,Physics,,,,,,11,N,Y,N,N,N,N,N,,,
J2 Activity and Decay,https://isaacphysics.org/questions/ch_j_p2,,Physics A-Level,N,Physics,,,,,,18,N,N,Y,N,N,N,N,,,
J3 Nuclear Decay with Time,https://isaacphysics.org/questions/ch_j_p3,,Physics A-Level,N,Physics,,,,,,22,N,N,Y,N,N,N,N,,,
J4 Energy and Nuclear Reaction,https://isaacphysics.org/questions/ch_j_p4,,Physics A-Level,N,Physics,,,,,,10,N,N,Y,N,N,N,N,,,
K1 Red-shift and Hubble's Law,https://isaacphysics.org/questions/ch_k_p1,,Physics A-Level,N,Physics,,,,,,20,N,N,Y,N,N,N,N,,,
K2 Exponential Extrapolation,https://isaacphysics.org/questions/ch_k_p2,,Physics A-Level,N,Physics,,,,,,10,N,N,Y,N,N,N,N,,,
I1 Charge and Energy Stored on a Capacitor,https://isaacphysics.org/questions/ch-i_p1,,Physics A-Level,N,Physics,,,,,,12,N,N,Y,N,N,N,N,,,
Linear Equations 1,https://isaacphysics.org/questions/rearrange_linear_1,,,N,Maths,1,Algebra,Manipulation,,,2,N,N,N,Y,Y,N,N,Algebraic Manipulation - Rearranging Equations and Units,,
Linear Equations 1,https://isaacphysics.org/questions/rearrange_linear_1_multi,,,N,Maths,1,Algebra,Manipulation,,,2,N,Y,N,N,Y,N,N,Algebraic Manipulation - Rearranging Equations and Units,,
Linear Equations 2,https://isaacphysics.org/questions/rearrange_linear_2,,,N,Maths,1,Algebra,Manipulation,,,3,N,N,N,Y,Y,N,N,Algebraic Manipulation - Rearranging Equations and Units,,
Linear Equations 2,https://isaacphysics.org/questions/rearrange_linear_2_multi,,,N,Maths,1,Algebra,Manipulation,,,3,N,Y,N,N,Y,N,N,Algebraic Manipulation - Rearranging Equations and Units,,
