A Ball Thrown Off a Cliff,https://isaacphysics.org/questions/ball_cliff,,,N,Physics,2,Mechanics,Kinematics,Equations of Motion - 2D,https://isaacphysics.org/gameboards#eqns_motion_2d,1,N,N,Y,N,Y,Y,Y,Equations of Motion,,
A Stoplight,https://isaacphysics.org/questions/stoplight,,,N,Physics,2,Mechanics,Kinematics,Newton's 2nd Law,,1,N,N,Y,N,Y,Y,Y,"Equations of Motion, Force, Newton's Second Law",,
Two Masses and a Peg,https://isaacphysics.org/questions/two_mass_peg,,,N,Physics,2,Mechanics,Kinematics,Newton's 2nd Law,,1,N,N,N,Y,Y,Y,Y,"Equations of Motion, Force, Newton's Second Law",,
The Collision Condition,https://isaacphysics.org/questions/collision_car_lorry_num,Y,,N,Physics,2,Mechanics,Kinematics,,,1,N,N,Y,N,Y,Y,Y,Equations of Motion,,
The Equations of Motion,https://isaacphysics.org/questions/define_suvat_num,Y,,N,Physics,2,Mechanics,Kinematics,,,5,Y,N,Y,N,Y,Y,Y,Equations of Motion,,
Reaction Time,https://isaacphysics.org/questions/reaction_time_num,Y,,N,Physics,2,Mechanics,Kinematics,,,1,N,N,Y,N,Y,Y,Y,Equations of Motion,,
Stopping Distances,https://isaacphysics.org/questions/stopping_distances_num,Y,,N,Physics,2,Mechanics,Kinematics,,,6,Y,N,Y,N,Y,Y,Y,"Equations of Motion, Newton's Second Law, Trigonometric Relationships, Vectors - Describing and Adding Vectors, Vectors - Resolving Vectors",,
Two Masses and a Peg,https://isaacphysics.org/questions/two_mass_peg_num,Y,,N,Physics,2,Mechanics,Kinematics,,,1,N,N,Y,N,Y,Y,Y,"Equations of Motion, Force, Newton's Second Law",,
Relative Velocity,https://isaacphysics.org/questions/relative_velocity,,,N,Physics,3,Mechanics,Kinematics,Adding Vectors,https://isaacphysics.org/gameboards#adding_vectors,1,N,Y,N,N,Y,Y,N,"Frames of Reference, Vectors - Resolving Vectors",,
A Jet in the Fog,https://isaacphysics.org/questions/foggy_jet,,,N,Physics,3,Mechanics,Kinematics,Equations of Motion - 1D - constant velocity,https://isaacphysics.org/gameboards#equations_motion_1,2,N,N,Y,N,Y,Y,Y,"Equations of Motion, Geometry - Shapes and their Properties, Trigonometric Sums",,
Highway Pursuit,https://isaacphysics.org/questions/highway_pursuit,,,N,Physics,3,Mechanics,Kinematics,Equations of Motion - 1D - constant velocity,https://isaacphysics.org/gameboards#equations_motion_1,1,N,Y,N,N,Y,Y,N,"Equations of Motion, Frames of Reference, Vectors - Resolving Vectors",,
The Lifeguard,https://isaacphysics.org/questions/lifeguard_num,,,N,Physics,3,Mechanics,Kinematics,Equations of Motion - 1D - constant velocity,https://isaacphysics.org/gameboards#equations_motion_1d,2,N,N,Y,N,Y,Y,Y,"Calculus - Differentiation, Equations of Motion, Trigonometric Relationships",,
Target Practice,https://isaacphysics.org/questions/target_practice,,,N,Physics,3,Mechanics,Kinematics,Equations of Motion - 2D,,1,N,Y,N,N,Y,Y,Y,"Equations of Motion, Simultaneous Equations",,
Projecting a Ball,https://isaacphysics.org/questions/projecting_ball,,,N,Physics,3,Mechanics,Kinematics,Equations of Motion - 2D,https://isaacphysics.org/gameboards#eqns_motion_2d,1,N,Y,N,N,Y,Y,Y,"Equations of Motion, Trigonometric Relationships, Vectors - Resolving Vectors",,
A Bomb and a Ship's Funnel,https://isaacphysics.org/questions/bomb_funnel,,,N,Physics,3,Mechanics,Kinematics,Equations of Motion - 2D,https://isaacphysics.org/gameboards#eqns_motion_2d,1,N,N,Y,N,Y,Y,Y,"Conservation of Energy, Equations of Motion, Linear Kinetic Energy, Potential Energy, Vectors - Describing and Adding Vectors",,
The Bolt Thrower,https://isaacphysics.org/questions/bolt_thrower,,,N,Physics,3,Mechanics,Kinematics,Equations of Motion - 2D,,2,N,N,N,Y,Y,Y,Y,"Equations of Motion, Trigonometric Relationships, Vectors - Describing and Adding Vectors",,
Lunar Landing,https://isaacphysics.org/questions/lunar_landing,,,N,Physics,3,Mechanics,Kinematics,Newton's 2nd Law,https://isaacphysics.org/gameboards#newton_2,2,N,N,Y,N,Y,Y,Y,"Equations of Motion, Linear Kinetic Energy, Newton's First Law, Newton's Second Law, Potential Energy",,
Stop the Train,https://isaacphysics.org/questions/stop_train,,,N,Physics,3,Mechanics,Kinematics,Newton's 2nd Law,https://isaacphysics.org/gameboards#newton_2,1,N,N,Y,N,Y,Y,Y,"Equations of Motion, Newton's Second Law",,
The Bolt Thrower,https://isaacphysics.org/questions/bolt_thrower_num,Y,,N,Physics,3,Mechanics,Kinematics,,,2,N,N,Y,N,Y,Y,Y,"Equations of Motion, Trigonometric Relationships, Vectors - Describing and Adding Vectors",,
A Polar Bear Heading North,https://isaacphysics.org/questions/polar_bear,,,N,Physics,4,Mechanics,Kinematics,Adding Vectors,https://isaacphysics.org/gameboards#adding_vectors,1,N,Y,N,N,Y,Y,Y,"Vectors - Describing and Adding Vectors, Vectors - Resolving Vectors",,
Ping-Pong on a Bus,https://isaacphysics.org/questions/ping_pong_bus_num,,,N,Physics,4,Mechanics,Kinematics,Adding Vectors,https://isaacphysics.org/gameboards#adding_vectors,1,N,Y,N,N,Y,Y,N,"Equations of Motion, Frames of Reference, Relative Velocity, Vectors - Describing and Adding Vectors, Vectors - Resolving Vectors",,
Swimming to a Boat,https://isaacphysics.org/questions/swimming_boat,,,N,Physics,4,Mechanics,Kinematics,Equations of Motion - 1D - constant velocity,,3,N,N,Y,N,Y,Y,Y,"Calculus - Differentiation, Equations of Motion, Vectors - Describing and Adding Vectors, Vectors - Resolving Vectors",,
Triangular Flying Course,https://isaacphysics.org/questions/triangular_flying_num,,,N,Physics,4,Mechanics,Kinematics,Equations of Motion - 1D - constant velocity,,1,N,N,Y,N,Y,Y,N,"Equations of Motion, Vectors - Describing and Adding Vectors, Vectors - Resolving Vectors",,
The Harbour Entrance,https://isaacphysics.org/questions/harbour_entrance,,,N,Physics,4,Mechanics,Kinematics,Equations of Motion - 1D - constant velocity,https://isaacphysics.org/gameboards#equations_motion_1,1,N,N,N,Y,Y,Y,Y,"Equations of Motion, Vectors - Describing and Adding Vectors, Vectors - Resolving Vectors",,
A Lifeboat,https://isaacphysics.org/questions/lifeboat,,,N,Physics,4,Mechanics,Kinematics,Equations of Motion - 1D - constant velocity,https://isaacphysics.org/gameboards#equations_motion_1,2,N,Y,Y,N,Y,Y,Y,"Equations of Motion, Quadratic Equations, Vectors - Describing and Adding Vectors, Vectors - Resolving Vectors",,
Will They Collide?,https://isaacphysics.org/questions/collision_conditionsii,,,N,Physics,4,Mechanics,Kinematics,Equations of Motion - 1D - non-zero acceleration,https://isaacphysics.org/gameboards#equations_motion_2,2,N,N,Y,Y,Y,Y,Y,"Equations of Motion, Frames of Reference, Quadratic Equations, Simultaneous Equations",,
Building a Tennis Court,https://isaacphysics.org/questions/build_tennis_court_num,,,N,Physics,4,Mechanics,Kinematics,Equations of Motion - 2D,,6,N,N,Y,N,Y,Y,Y,"Calculus - Differentiation, Equations of Motion, Newton's Second Law, Simultaneous Equations, Trigonometric Relationships, Trigonometric Sums, Vectors - Resolving Vectors",,
Broken Cannon,https://isaacphysics.org/questions/broken_cannon,,,N,Physics,4,Mechanics,Kinematics,Equations of Motion - 2D,https://isaacphysics.org/gameboards#eqns_motion_2d,2,N,N,Y,N,Y,Y,Y,"Equations of Motion, Simultaneous Equations, Vectors - Resolving Vectors",,
Will They Collide?,https://isaacphysics.org/questions/collision_conditionsii_num,Y,,N,Physics,4,Mechanics,Kinematics,,,2,N,N,Y,N,Y,Y,Y,"Equations of Motion, Quadratic Equations, Simultaneous Equations",,
The Harbour Entrance,https://isaacphysics.org/questions/harbour_entrance_num,Y,,N,Physics,4,Mechanics,Kinematics,,,1,N,N,Y,N,Y,Y,Y,"Vectors - Describing and Adding Vectors, Vectors - Resolving Vectors",,
Crossing a River,https://isaacphysics.org/questions/boat_river_num,,,N,Physics,5,Mechanics,Kinematics,Equations of Motion - 1D - constant velocity,,1,N,N,Y,N,Y,Y,Y,"Calculus - Differentiation, Calculus - Introduction to Integration, Equations of Motion, Vectors - Describing and Adding Vectors, Vectors - Resolving Vectors",,
Sliding inside a Hoop,https://isaacphysics.org/questions/bead_wire_chord_num,,,N,Physics,5,Mechanics,Kinematics,Equations of Motion - 1D - free fall,,1,N,N,Y,N,Y,Y,Y,"Equations of Motion, Force, Newton's Second Law, Vectors - Resolving Vectors",,
Throwing a Ball up a Flat Slope,https://isaacphysics.org/questions/throw_ball_flat,,,N,Physics,5,Mechanics,Kinematics,Equations of Motion - 2D,,1,N,Y,N,N,Y,N,Y,Equations of Motion,,
Reaching a Sloping Roof,https://isaacphysics.org/questions/reaching_sloping_roof_num,,,N,Physics,5,Mechanics,Kinematics,Equations of Motion - 2D,https://isaacphysics.org/gameboards#eqns_motion_2d,2,N,N,Y,N,Y,N,Y,"Calculus - Differentiation, Equations of Motion",,
Shooting a Balloon,https://isaacphysics.org/questions/shooting_balloon_num,,,N,Physics,5,Mechanics,Kinematics,Equations of Motion - 2D,,2,N,N,Y,N,Y,N,Y,Equations of Motion,,
Maximum Angle Throw,https://isaacphysics.org/questions/ball_maximum_angle,,,N,Physics,5,Mechanics,Kinematics,Equations of Motion - 2D,,1,N,N,Y,N,Y,Y,N,"Calculus - Differentiation, Equations of Motion",,
Thrown off a Cliff,https://isaacphysics.org/questions/ball_off_cliff_num,,,N,Physics,5,Mechanics,Kinematics,Equations of Motion - 2D,,2,N,N,Y,N,Y,Y,Y,"Equations of Motion, Trigonometric Relationships",,
Bouncing a Ball across a Half-Pipe,https://isaacphysics.org/questions/ball_bouncing_dip_num,,,N,Physics,5,Mechanics,Kinematics,Equations of Motion - 2D,,1,N,N,Y,N,Y,Y,Y,"Collisions, Equations of Motion",,
The Michelson-Morley Experiment,https://isaacphysics.org/questions/michaelson_morley_num,Y,,N,Physics,5,Mechanics,Kinematics,,,3,N,N,Y,N,Y,N,Y,"Equations of Motion, Relative Velocity, Vectors - Describing and Adding Vectors, Vectors - Resolving Vectors",,
Stuck in the Mud,https://isaacphysics.org/questions/stuck_in_mud,,,N,Physics,5,Mechanics,Kinematics,Work Energy and Power,,1,N,N,Y,N,Y,Y,Y,"Calculus - Differentiation, Circular Kinematics, Conservation of Energy, Equations of Motion",,
The Michaelson-Morley Experiment,https://isaacphysics.org/questions/michaelson_morley,,,N,Physics,5,Mechanics,Kinematics,,,3,N,N,N,Y,Y,N,Y,"Equations of Motion, Relative Velocity, Series, Vectors - Describing and Adding Vectors, Vectors - Resolving Vectors",,
The Ant and the Tortoise,https://isaacphysics.org/questions/ant_tortoise_elastic_num,,,N,Physics,6,Mechanics,Kinematics,,,1,N,N,Y,N,Y,Y,Y,"Differential Equations, Equations of Motion, Relative Velocity",,
The Bouncing Ball,https://isaacphysics.org/questions/bouncing_ball_num,,,N,Physics,6,Mechanics,Kinematics,,,2,N,N,Y,N,Y,N,N,"Equations of Motion, Series",,
The Directrix of a Parabola,https://isaacphysics.org/questions/directrix_num,,,N,Physics,6,Mechanics,Kinematics,,,4,Y,Y,Y,N,Y,N,Y,"Equations of Motion, Frames of Reference",,
Angle of a Chip in Golf,https://isaacphysics.org/questions/golf_chip_angle_range_num,,,N,Physics,6,Mechanics,Kinematics,,,1,N,N,Y,N,Y,N,Y,Equations of Motion,,
Jumping over a Log,https://isaacphysics.org/questions/jump_over_log_num,,,N,Physics,6,Mechanics,Kinematics,,,1,N,N,Y,N,Y,Y,Y,"Conservation of Energy, Equations of Motion, Linear Kinetic Energy, Potential Energy",,
Light Clock,https://isaacphysics.org/questions/light_clock_num,,,N,Physics,6,Mechanics,Kinematics,,,3,N,Y,Y,N,Y,Y,Y,"Equations of Motion, Relative Velocity",,
Longest Trajectory of a Thrown Ball,https://isaacphysics.org/questions/longest_flight,,,N,Physics,6,Mechanics,Kinematics,,,1,N,N,Y,N,Y,N,N,Equations of Motion,,
Love Bugs,https://isaacphysics.org/questions/love_bugs_num,,,N,Physics,6,Mechanics,Kinematics,,,1,N,N,Y,N,Y,Y,Y,"Equations of Motion, Relative Velocity",,
A Search Spiral,https://isaacphysics.org/questions/search_spiral_num,,,N,Physics,6,Mechanics,Kinematics,,,1,N,N,Y,N,Y,N,Y,"Calculus - Integrating Common Functions, Calculus - Introduction to Integration",,
Catching Smugglers,https://isaacphysics.org/questions/smuggler_catching_spiral,,,N,Physics,6,Mechanics,Kinematics,,,1,N,N,Y,N,Y,N,Y,Equations of Motion,,
Weighing at Sea,https://isaacphysics.org/questions/weigh_sea,,,N,Physics,4,Mechanics,SHM,SHM,,1,N,N,N,Y,Y,Y,Y,"Hooke's Law, Newton's Second Law, Simple Harmonic Motion",,
Acceleration during SHM,https://isaacphysics.org/questions/acceleration_shm,,,N,Physics,4,Mechanics,SHM,SHM,https://isaacphysics.org/gameboards#shm,2,N,N,Y,N,Y,N,Y,Simple Harmonic Motion,,
Two Spring SHM,https://isaacphysics.org/questions/two_spring_SHM,,,N,Physics,4,Mechanics,SHM,SHM,https://isaacphysics.org/gameboards#shm,1,N,Y,N,N,Y,Y,Y,"Hooke's Law, Linear Kinetic Energy, Simple Harmonic Motion",,
Maximum Speed in SHM,https://isaacphysics.org/questions/max_speed_shm,,,N,Physics,4,Mechanics,SHM,SHM,https://isaacphysics.org/gameboards#shm,1,N,Y,N,N,Y,N,Y,Simple Harmonic Motion,,
Chopping up Springs,https://isaacphysics.org/questions/chopping_springs,,,N,Physics,4,Mechanics,SHM,SHM - Springs,https://isaacphysics.org/gameboards#shm_springs,3,N,N,N,Y,Y,Y,Y,"Hooke's Law, Simple Harmonic Motion",,
Car Suspension over Bumps,https://isaacphysics.org/questions/car_suspension_bumps,,,N,Physics,4,Mechanics,SHM,SHM - time period,,1,N,N,N,Y,Y,Y,Y,"Equations of Motion, Hooke's Law, Simple Harmonic Motion",,
Period of SHM,https://isaacphysics.org/questions/period_shm,,,N,Physics,4,Mechanics,SHM,SHM - time period,https://isaacphysics.org/gameboards#shm_time_period,1,N,Y,N,N,Y,N,Y,Simple Harmonic Motion,,
SHM of a Simple Scale,https://isaacphysics.org/questions/shm_simple_scale,,,N,Physics,4,Mechanics,SHM,SHM - time period,https://isaacphysics.org/gameboards#shm_time_period,4,N,N,Y,N,Y,Y,Y,"Hooke's Law, Simple Harmonic Motion",,
Swinging Rod,https://isaacphysics.org/questions/swinging_rod,,,N,Physics,4,Mechanics,SHM,SHM - time period,https://isaacphysics.org/gameboards#shm_time_period,4,N,N,Y,N,Y,Y,Y,Simple Harmonic Motion,,
Pendulum in a Lift,https://isaacphysics.org/questions/pendulum_lift,,,N,Physics,4,Mechanics,SHM,SHM - time period,https://isaacphysics.org/gameboards#shm_time_period,1,N,Y,N,N,Y,Y,Y,Simple Harmonic Motion,,
Car Suspension over Bumps,https://isaacphysics.org/questions/car_suspension_bumps_num,Y,,N,Physics,4,Mechanics,SHM,,,1,N,N,Y,N,Y,Y,Y,"Hooke's Law, Simple Harmonic Motion",,
Chopping up Springs,https://isaacphysics.org/questions/chopping_springs_num,Y,,N,Physics,4,Mechanics,SHM,,,3,N,N,Y,N,Y,Y,Y,"Hooke's Law, Simple Harmonic Motion",,
Weighing at Sea,https://isaacphysics.org/questions/weigh_sea_num,Y,,N,Physics,4,Mechanics,SHM,,,1,N,N,Y,N,Y,Y,Y,"Hooke's Law, Newton's Second Law, Simple Harmonic Motion",,
A Rod Pendulum,https://isaacphysics.org/questions/rod_pendulum,,,N,Physics,5,Mechanics,SHM,SHM,,3,N,N,Y,N,Y,Y,Y,"Angular Motion, Calculus - Integrating Common Functions, Calculus - Introduction to Integration, Centre of Mass, Moment of Inertia, Moments or Torques, Newton's Second Law for Rotation, Simple Harmonic Motion",,
A Simple Pendulum,https://isaacphysics.org/questions/simple_pendulum_num,,,N,Physics,5,Mechanics,SHM,SHM,,3,N,N,Y,N,Y,Y,Y,"Force, Moment of Inertia, Newton's Second Law, Simple Harmonic Motion, Trigonometric Relationships, Vectors - Resolving Vectors",,
Safe Passage,https://isaacphysics.org/questions/safe_passage,,,N,Physics,5,Mechanics,SHM,SHM,,1,N,N,Y,N,Y,Y,Y,Simple Harmonic Motion,,
Mass on a Horizontal Spring,https://isaacphysics.org/questions/shm_horizontal_spring,,,N,Physics,5,Mechanics,SHM,SHM,https://isaacphysics.org/gameboards#shm,1,N,N,Y,N,Y,Y,Y,"Hooke's Law, Simple Harmonic Motion",,
A Diatomic Molecule,https://isaacphysics.org/questions/diatomic_molecule_num,,,N,Physics,5,Mechanics,SHM,SHM - Springs,https://isaacphysics.org/gameboards#shm_springs,2,N,N,Y,N,Y,Y,Y,"Centre of Mass, Force, Hooke's Law, Momentum & Conservation of Momentum, Simple Harmonic Motion",,
Different Spring Circuit,https://isaacphysics.org/questions/different_spring_circuit,,,N,Physics,5,Mechanics,SHM,SHM - Springs,https://isaacphysics.org/gameboards#shm_springs,1,N,N,N,Y,Y,N,Y,"Hooke's Law, Simple Harmonic Motion",,
Similar Spring Circuit,https://isaacphysics.org/questions/spring_circuit_sym,,,N,Physics,5,Mechanics,SHM,SHM - Springs,https://isaacphysics.org/gameboards#shm_springs,2,N,N,Y,Y,Y,Y,Y,"Hooke's Law, Newton's Second Law, Simple Harmonic Motion",,
Mercury in a U-Tube,https://isaacphysics.org/questions/mercury_u_tube,,,N,Physics,5,Mechanics,SHM,SHM - time period,,2,N,N,Y,N,Y,Y,Y,"Conservation of Energy, Force, Linear Kinetic Energy, Newton's Second Law, Potential Energy, Simple Harmonic Motion, Work",,
A Bobbing Buoy,https://isaacphysics.org/questions/floating_object,,,N,Physics,5,Mechanics,SHM,SHM - time period,https://isaacphysics.org/gameboards#shm_time_period,1,N,Y,N,N,Y,Y,Y,Simple Harmonic Motion,,
Accuracy of an SHM Approximation,https://isaacphysics.org/questions/accuracy_shm_pendulum_num,Y,,N,Physics,5,Mechanics,SHM,,,3,N,N,Y,N,Y,Y,Y,"Conservation of Energy, Linear Kinetic Energy, Newton's Second Law, Potential Energy, Simple Harmonic Motion, Vectors - Resolving Vectors",,
Different Spring Circuit,https://isaacphysics.org/questions/different_spring_circuit_num,Y,,N,Physics,5,Mechanics,SHM,,,1,N,N,Y,N,Y,N,Y,"Hooke's Law, Simple Harmonic Motion",,
Similar Spring Circuit,https://isaacphysics.org/questions/spring_circuit,Y,,N,Physics,5,Mechanics,SHM,,,2,N,Y,Y,N,Y,Y,Y,"Hooke's Law, Newton's Second Law, Simple Harmonic Motion",,
A Damped Pendulum,https://isaacphysics.org/questions/damped_pendulum_num,,,N,Physics,6,Mechanics,SHM,,,4,N,Y,Y,N,Y,Y,Y,"Differential Equations, Force, Moment of Inertia, Newton's Second Law, Simple Harmonic Motion, Vectors - Resolving Vectors",,
Ball Dropped onto Spring,https://isaacphysics.org/questions/drop_ball_spring,,,N,Physics,6,Mechanics,SHM,,,1,N,N,Y,N,Y,Y,Y,"Equations of Motion, Hooke's Law, Newton's First Law, Simple Harmonic Motion",,
Gravtube,https://isaacphysics.org/questions/gravtube_num,,,N,Physics,6,Mechanics,SHM,,,2,N,N,Y,N,Y,Y,Y,"Circular Kinematics, Equations of Motion, Gravitational Field, Newton's Second Law, Simple Harmonic Motion",,
Mass Resting on a Spring,https://isaacphysics.org/questions/mass_rest_spring,,,N,Physics,6,Mechanics,SHM,,,1,N,Y,N,N,Y,N,Y,"Equations of Motion, Hooke's Law, Newton's Second Law, Simple Harmonic Motion",,
SHM In Two Dimensions,https://isaacphysics.org/questions/shm_2d_num,,,N,Physics,6,Mechanics,SHM,,,4,Y,N,Y,N,Y,N,Y,"Circular Kinematics, Force, Hooke's Law, Newton's Second Law, Simple Harmonic Motion, Vectors - Resolving Vectors",,
SHM Perpendicular to a Spring,https://isaacphysics.org/questions/shm_right_angles_num,,,N,Physics,6,Mechanics,SHM,,,3,N,N,Y,N,Y,Y,Y,"Hooke's Law, Newton's Second Law, Simple Harmonic Motion, Vectors - Resolving Vectors",,
Spring Pick-up,https://isaacphysics.org/questions/spring_pick_up_num,,,N,Physics,6,Mechanics,SHM,,,2,N,N,Y,N,Y,N,Y,"Equations of Motion, Frames of Reference, Hooke's Law, Simple Harmonic Motion",,
T Shaped Pendulum,https://isaacphysics.org/questions/t_pendulum_num,,,N,Physics,6,Mechanics,SHM,,,3,N,N,Y,N,Y,Y,Y,"Centre of Mass, Conservation of Energy, Rotational Kinetic Energy, Moment of Inertia, Potential Energy, Simple Harmonic Motion",,
Tension in a Simple Pendulum,https://isaacphysics.org/questions/tension_pendulum_num,,,N,Physics,6,Mechanics,SHM,,,1,N,N,Y,N,Y,N,N,"Circular Kinematics, Simple Harmonic Motion",,
Two Mass Pendulum,https://isaacphysics.org/questions/two_mass_pendulum_num,,,N,Physics,6,Mechanics,SHM,,,1,N,N,Y,N,Y,Y,Y,"Moment of Inertia, Newton's Second Law, Simple Harmonic Motion",,
The Weighing Machine,https://isaacphysics.org/questions/weigh_machine,,,N,Physics,6,Mechanics,SHM,,,5,N,N,N,Y,Y,N,N,"Conservation of Energy, Hooke's Law, Simple Harmonic Motion",,
The Weighing Machine,https://isaacphysics.org/questions/weigh_machine_num,,,N,Physics,6,Mechanics,SHM,,,5,N,N,Y,N,Y,N,N,"Conservation of Energy, Hooke's Law, Simple Harmonic Motion",,
Accuracy of an SHM Approximation,https://isaacphysics.org/questions/accuracy_shm_pendulum,,,N,Physics,,Mechanics,SHM,SHM,,3,N,N,Y,Y,Y,Y,Y,"Conservation of Energy, Linear Kinetic Energy, Newton's Second Law, Potential Energy, Simple Harmonic Motion, Vectors - Resolving Vectors",,
Symmetry and Centre of Mass,https://isaacphysics.org/questions/symmetry_and_com,,,N,Physics,1,Mechanics,Statics,Centre of Mass,,5,Y,N,N,Y,Y,Y,Y,"Centre of Mass, Trigonometric Relationships",,
Cases of Equilibria,https://isaacphysics.org/questions/cases_of_equilibria,,,N,Physics,1,Mechanics,Statics,Equilibrium,,1,N,Y,N,N,Y,N,N,"Equilibrium, Force, Newton's First Law",,
Human Tower,https://isaacphysics.org/questions/human_tower,,,N,Physics,1,Mechanics,Statics,Equilibrium,,3,N,N,Y,N,Y,Y,Y,"Equilibrium, Force, Newton's First Law","1. Three Forces, 4. Projecting a Particle",
The Three Force Problem,https://isaacphysics.org/questions/three_forces,,,N,Physics,1,Mechanics,Statics,Equilibrium,,2,Y,N,Y,N,Y,Y,N,"Equilibrium, Force, Newton's First Law, Vectors - Describing and Adding Vectors","1. Three Forces, 10. Two Particles on a Pulley, 4. Projecting a Particle, 5. A Particle and a Ring, 6. A Ring on a String, 9. Three Particles on a Pulley",
Tug o' War,https://isaacphysics.org/questions/tug_of_war,,,N,Physics,1,Mechanics,Statics,Equilibrium,,1,N,N,N,Y,Y,Y,Y,"Equilibrium, Force, Newton's First Law","1. Three Forces, 11. Loading Parcels, 5. A Particle and a Ring, 6. A Ring on a String",
Thinking about Friction,https://isaacphysics.org/questions/thinking_about_friction,,,N,Physics,1,Mechanics,Statics,Equilibrium,,3,Y,N,Y,N,Y,Y,Y,"Equilibrium, Force, Friction, Newton's First Law",12. Particles Colliding on a Plane,
Motion at a Constant Speed,https://isaacphysics.org/questions/basic_concepts,,,N,Physics,1,Mechanics,Statics,Equilibrium,https://isaacphysics.org/gameboards#equilibrium,1,N,Y,N,N,Y,Y,N,"Equilibrium, Force, Newton's First Law, Newton's Second Law, Vectors - Describing and Adding Vectors",13. Projectile,
Bed of Nails,https://isaacphysics.org/questions/bed_of_nails,,,N,Physics,1,Mechanics,Statics,Equilibrium,https://isaacphysics.org/gameboards#equilibrium,3,Y,N,Y,N,Y,Y,Y,"Equilibrium, Force, Newton's First Law","14. Particle Travelling in Straight Line, 16. Curve sketching, 31. Integration and Area",
Misbehaving Student,https://isaacphysics.org/questions/misbehaving_student,,,N,Physics,1,Mechanics,Statics,Equilibrium,https://isaacphysics.org/gameboards#equilibrium,1,N,N,Y,N,Y,Y,N,"Equilibrium, Force, Newton's First Law","1. Three Forces, 11. Loading Parcels, 15. Uniform Solid Cone, 5. A Particle and a Ring",
Action and Reaction Pairs,https://isaacphysics.org/questions/action_reaction_pairs,,,N,Physics,1,Mechanics,Statics,Newton's 3rd Law,https://isaacphysics.org/gameboards#newton_3,1,N,Y,N,N,Y,Y,Y,Newton's Third Law of Motion,16. 2 Particle Collision,
Tug o' War,https://isaacphysics.org/questions/tug_of_war_num,Y,,N,Physics,1,Mechanics,Statics,,,1,N,N,Y,N,Y,Y,Y,"Equilibrium, Force, Newton's First Law","1. Three Forces, 2. A Box on a Plane",
Symmetry and Centre of Mass,https://isaacphysics.org/questions/symmetry_and_com_num,Y,,N,Physics,1,Mechanics,Statics,,,5,Y,N,Y,N,Y,Y,Y,"Centre of Mass, Trigonometric Relationships","3. Air Resistance on Particles, 4. Projecting a Particle, 8. A Furniture Van",
Size of a Combined Force,https://isaacphysics.org/questions/size_combined_force,,,N,Physics,2,Mechanics,Statics,Adding Vectors,https://isaacphysics.org/gameboards#adding_vectors,1,N,Y,N,N,Y,Y,Y,"Force, Vectors - Describing and Adding Vectors","1. Three Forces, 4. Projecting a Particle",
Hanging A Picture,https://isaacphysics.org/questions/hanging_picture,,,N,Physics,2,Mechanics,Statics,Equilibrium,,1,N,Y,N,N,Y,Y,Y,"Equilibrium, Force, Newton's First Law, Vectors - Describing and Adding Vectors, Vectors - Resolving Vectors","1. Three Forces, 4. Projecting a Particle, 5. A Particle and a Ring, 6. A Ring on a String",
Force on Table Legs,https://isaacphysics.org/questions/table_forces,,,N,Physics,2,Mechanics,Statics,Equilibrium,,2,N,N,Y,N,Y,Y,Y,"Equilibrium, Force, Newton's First Law, Vectors - Describing and Adding Vectors","1. Three Forces, 5. A Particle and a Ring, 6. A Ring on a String",
Suspended Block,https://isaacphysics.org/questions/suspended_block_sym,,,N,Physics,2,Mechanics,Statics,Equilibrium,,2,N,N,N,Y,Y,Y,Y,"Equilibrium, Force, Newton's First Law, Vectors - Describing and Adding Vectors, Vectors - Resolving Vectors","1. Three Forces, 12. Particles Colliding on a Plane, 2. A Box on a Plane, 4. Projecting a Particle, 7. A Car and a Trailer, 8. A Furniture Van",
Helicopter Rising,https://isaacphysics.org/questions/helicopter_rising,,,N,Physics,2,Mechanics,Statics,Equilibrium,https://isaacphysics.org/gameboards#equilibrium,1,N,Y,N,N,Y,N,Y,"Equilibrium, Force, Newton's First Law, Vectors - Describing and Adding Vectors","4. Projecting a Particle, 8. A Furniture Van",
A Parachutist,https://isaacphysics.org/questions/parachutist_resolving,,,N,Physics,2,Mechanics,Statics,Equilibrium,https://isaacphysics.org/gameboards#equilibrium,1,N,N,Y,N,Y,Y,Y,"Equilibrium, Force, Newton's First Law, Vectors - Describing and Adding Vectors","10. Two Particles on a Pulley, 4. Projecting a Particle, 8. A Furniture Van, 9. Three Particles on a Pulley",
Towel on a Washing Line,https://isaacphysics.org/questions/towel_washing_line_num,,,N,Physics,2,Mechanics,Statics,Equilibrium,https://isaacphysics.org/gameboards#equilibrium,1,N,N,Y,N,Y,Y,Y,"Equilibrium, Force, Newton's First Law, Vectors - Describing and Adding Vectors, Vectors - Resolving Vectors","1. Three Coplanar Forces, 4. Projecting a Particle",
An Anchored Buoy,https://isaacphysics.org/questions/buoy_and_anchor,,,N,Physics,2,Mechanics,Statics,Newton's 2nd Law,,1,N,N,Y,N,Y,Y,Y,"Equilibrium, Force, Geometry - Shapes and their Properties, Newton's First Law, Vectors - Describing and Adding Vectors","10. Ring on a String, 11. Loading Parcels, 12. Particles Colliding on a Plane, 13. Projectile, 4. Projecting a Particle, 9. Three Particles on a Pulley",
