Right Angled Triangle 2,https://isaacphysics.org/questions/right_angled_triangle2,,,N,Maths,1,Geometry,Trigonometry,,,3,N,N,Y,N,N,N,N,"Geometry - Angles and Triangles, Trigonometric Relationships","Ammeter Sensitivity, Internal Resistance in Series, Meter Measurements, Resistors in Parallel and Series, Voltage Measurement",
Sine and Cosine Rules 1,https://isaacphysics.org/questions/sine_cos_rules1,,,N,Maths,1,Geometry,Trigonometry,,,2,N,N,Y,N,N,N,N,"Geometry - Angles and Triangles, Trigonometric Relationships","A Diode Divider, Heating an Electric Fire, Lighting a Lamp, Making Bulbs Brighter",
Sine and Cosine Rules 2,https://isaacphysics.org/questions/sine_cos_rules2,,,N,Maths,1,Geometry,Trigonometry,,,2,N,N,Y,N,N,N,N,"Geometry - Angles and Triangles, Trigonometric Relationships","A Fuse Problem, Fuse and Resistors in Series, Lighting a Lamp, Motor Efficiency, Resistors in Parallel",
Sine and Cosine Rules 3,https://isaacphysics.org/questions/sine_cos_rules3,,,N,Maths,1,Geometry,Trigonometry,,,1,N,N,Y,N,N,N,N,"Geometry - Angles and Triangles, Trigonometric Relationships","Bulbs and Power, Lighting a Lamp, Melting a Snowman, Power Limited Resistors, Which Fuse to Use",
Exact Values of Angles 1,https://isaacphysics.org/questions/exact_values_of_angles1,,,N,Maths,2,Geometry,Trigonometry,,,1,N,Y,N,N,N,N,N,Trigonometric Relationships,"Amplitude Modulation, Decibels, Light Has the Power, Light Up A Mirror",
Exact Values of Angles 2,https://isaacphysics.org/questions/exact_values_of_angles2`,,,N,Maths,2,Geometry,Trigonometry,,,1,N,Y,N,N,N,N,N,Trigonometric Relationships,"EM Frequencies, Multicoloured Pinhole, Out of the Shadows, Shifted Spectra",
Exact Values of Angles 3,https://isaacphysics.org/questions/exact_values_of_angles3,,,N,Maths,2,Geometry,Trigonometry,,,1,N,Y,N,N,N,N,N,Trigonometric Relationships,"EM Frequencies, Out of the Shadows",
Exact Values of Cosine,https://isaacphysics.org/questions/exact_values_of_cos,,,N,Maths,2,Geometry,Trigonometry,,,1,N,Y,N,N,N,N,N,Trigonometric Relationships,"Cat's Eye, Deriving the Lensmaker's Equation, Moon Halo, Optical Dipstick, Perpendicular Rays, Seeing Double, The Light Pipe",
Exact Values of Sine,https://isaacphysics.org/questions/exact_values_of_sin,,,N,Maths,2,Geometry,Trigonometry,,,1,N,Y,N,N,N,N,N,Trigonometric Relationships,"Cat's Eye, Deriving the Lensmaker's Equation, Moon Halo, Optical Dipstick, Perpendicular Rays, Seeing Double, The Light Pipe",
Exact Values of Tangent,https://isaacphysics.org/questions/exact_values_of_tan,,,N,Maths,2,Geometry,Trigonometry,,,1,N,Y,N,N,N,N,N,Trigonometric Relationships,"Finding the Invisible, Light Beats, Multicoloured Pinhole, Out of the Shadows, X-ray Production",
Right Angled Triangle 3,https://isaacphysics.org/questions/right_angled_triangle3,,,N,Maths,2,Geometry,Trigonometry,,,3,N,N,Y,N,N,N,N,"Geometry - Angles and Triangles, Trigonometric Relationships","Decibels, Light Pressure, Wave Direction",
Values of Angles 1,https://isaacphysics.org/questions/values_of_angles1,,,N,Maths,2,Geometry,Trigonometry,,,2,N,N,Y,N,N,N,N,Trigonometric Relationships,Reaction Profiling,
Values of Angles 2,https://isaacphysics.org/questions/values_of_angles2,,,N,Maths,2,Geometry,Trigonometry,,,2,N,N,Y,N,N,N,N,,Formic Acid Dissociation,
Values of Angles 3,https://isaacphysics.org/questions/values_of_angles3,,,N,Maths,2,Geometry,Trigonometry,,,2,N,N,Y,N,N,N,N,Trigonometric Relationships,Golden Ring,
Values of Angles 4,https://isaacphysics.org/questions/values_of_angles4,,,N,Maths,2,Geometry,Trigonometry,,,2,N,N,Y,N,N,N,N,Trigonometric Relationships,Enthalpy Change of Fusion,
Values of Angles 5,https://isaacphysics.org/questions/values_of_angles5,,,N,Maths,2,Geometry,Trigonometry,,,2,N,N,Y,N,N,N,N,Trigonometric Relationships,"Diet Cola, Glass Calorimeter, The Mysterious Ice Machine",
Values of Angles 6,https://isaacphysics.org/questions/values_of_angles6,,,N,Maths,2,Geometry,Trigonometry,,,2,N,N,Y,N,N,N,N,Trigonometric Relationships,"Candle Calorimetry, Diet Cola, Glass Calorimeter, Spoonful of Sugar",
Adding Two Forces 1,https://isaacphysics.org/questions/addition_of_forces1,,,N,Maths,3,Geometry,Trigonometry,,,2,N,N,Y,N,N,N,N,Trigonometric Relationships,,
Adding Two Forces 2,https://isaacphysics.org/questions/addition_of_forces2_multi,,,N,Maths,3,Geometry,Trigonometry,,,2,N,Y,N,N,N,N,N,Trigonometric Relationships,,
Angles and Projection,https://isaacphysics.org/questions/angles_and_projection,,,N,Maths,3,Geometry,Trigonometry,,,2,N,Y,Y,N,N,N,N,Trigonometric Relationships,An Ionic Compound,
Circles and Arcs 1,https://isaacphysics.org/questions/circles_and_arcs1_multi,,,N,Maths,3,Geometry,Trigonometry,,,4,N,Y,N,N,N,N,N,"Geometry - Shapes and their Properties, Trigonometric Relationships",Great Gibbs!,
Circles and Arcs 2,https://isaacphysics.org/questions/circles_and_arcs2,,,N,Maths,3,Geometry,Trigonometry,,,5,N,N,Y,N,N,N,N,"Geometry - Shapes and their Properties, Trigonometric Relationships","Candle Calorimetry, Glass Calorimeter, Spoonful of Sugar, The Mysterious Ice Machine",
Circles and Triangles 1,https://isaacphysics.org/questions/circles_and_triangles1_multi,,,N,Maths,3,Geometry,Trigonometry,,,2,N,Y,N,N,N,N,N,"Geometry - Shapes and their Properties, Trigonometric Relationships","Candle Calorimetry, Diet Cola, Spoonful of Sugar, The Mysterious Ice Machine",
Circles and Triangles 2,https://isaacphysics.org/questions/circles_and_triangles2_multi,,,N,Maths,3,Geometry,Trigonometry,,,3,N,Y,Y,N,N,N,N,"Geometry - Angles and Triangles, Trigonometric Relationships","Candle Calorimetry, Glass Calorimeter, The Mysterious Ice Machine",
Degrees to Radians 1,https://isaacphysics.org/questions/degrees_to_radians1_num,,,N,Maths,3,Geometry,Trigonometry,,,4,N,N,Y,N,N,N,N,"Geometry - Angles and Triangles, Trigonometric Relationships","Autoignition, Fireworks!, Gas Sphere, Helium Balloon, Mixture of Gases, Van der Waals Gas",
Degrees to Radians 2,https://isaacphysics.org/questions/degrees_to_radians2,,,N,Maths,3,Geometry,Trigonometry,,,4,N,N,Y,N,N,N,N,"Geometry - Angles and Triangles, Trigonometric Relationships","Reducing Iron Oxide, Wine to Vinegar",
Energy of Oscillating Mass,https://isaacphysics.org/questions/oscillating_mass_energy_multi,,,N,Maths,3,Geometry,Trigonometry,,,2,Y,Y,N,N,N,N,N,"Trigonometric Relationships, Trigonometric Sums","Reducing Iron Oxide, Wine to Vinegar",
Oscillating Mass,https://isaacphysics.org/questions/oscillating_mass_multi,,,N,Maths,3,Geometry,Trigonometry,,,4,Y,Y,N,N,N,N,N,Trigonometric Relationships,"Lunar Propulsion, Wine to Vinegar",
Radians to Degrees 1,https://isaacphysics.org/questions/radians_to_degrees1,,,N,Maths,3,Geometry,Trigonometry,,,4,N,N,Y,N,N,N,N,"Geometry - Angles and Triangles, Trigonometric Relationships","Lunar Propulsion, Reducing Iron Oxide",
Radians to Degrees 2,https://isaacphysics.org/questions/radians_to_degrees2,,,N,Maths,3,Geometry,Trigonometry,,,4,N,N,Y,N,N,N,N,"Geometry - Angles and Triangles, Trigonometric Relationships","Combustion and Formation, Molybdenum Reduction",
Roots of Trig Equations 1,https://isaacphysics.org/questions/roots_of_equations1,,,N,Maths,3,Geometry,Trigonometry,,,2,N,N,Y,N,N,N,N,Trigonometric Relationships,"Bond Enthalpies, Discovering Phosphorus, Water Vaporisation",
Roots of Trig Equations 2,https://isaacphysics.org/questions/roots_of_equations2,,,N,Maths,3,Geometry,Trigonometry,,,2,N,N,Y,N,N,N,N,"Geometry - Angles and Triangles, Trigonometric Relationships","Acid Rain, Baffling Benzene, Molybdenum Reduction",
Simplify Trig Expressions,https://isaacphysics.org/questions/simplify_trig_expressions_multi,,,N,Maths,3,Geometry,Trigonometry,,,4,N,Y,N,N,N,N,N,"Trigonometric Relationships, Trigonometric Sums","Bond Enthalpies, Bonds in Carbon Dioxide, Water Vaporisation",
Addition of Angles 1,https://isaacphysics.org/questions/addition_of_angles1_multi,,,N,Maths,4,Geometry,Trigonometry,,,2,N,Y,N,N,N,N,N,"Trigonometric Relationships, Trigonometric Sums","Acid Rain, Combustion and Formation",
Addition of Angles 2,https://isaacphysics.org/questions/addition_of_angles2_multi,,,N,Maths,4,Geometry,Trigonometry,,,1,N,Y,N,N,N,N,N,"Trigonometric Relationships, Trigonometric Sums",Combustion and Formation,
Addition of Angles 3,https://isaacphysics.org/questions/addition_of_angles3_multi,,,N,Maths,4,Geometry,Trigonometry,,,2,N,Y,N,N,N,N,N,"Trigonometric Relationships, Trigonometric Sums",Keep hydrated,
Addition of Angles 4,https://isaacphysics.org/questions/addition_of_angles4_num,,,N,Maths,4,Geometry,Trigonometry,,,1,N,N,Y,N,N,N,N,"Trigonometric Relationships, Trigonometric Sums",Happy Halogens,
Addition of Angles 5,https://isaacphysics.org/questions/addition_of_angles5_multi,,,N,Maths,4,Geometry,Trigonometry,,,2,N,Y,N,N,N,N,N,"Trigonometric Relationships, Trigonometric Sums",Latticework,
Addition of Angles 6,https://isaacphysics.org/questions/addition_of_angles6_num,,,N,Maths,4,Geometry,Trigonometry,,,2,N,N,Y,N,N,N,N,"Trigonometric Relationships, Trigonometric Sums",,
Addition of Angles 7,https://isaacphysics.org/questions/addition_of_angles7_multi,,,N,Maths,4,Geometry,Trigonometry,,,1,N,Y,N,N,N,N,N,"Trigonometric Relationships, Trigonometric Sums",Combustion and Formation,
Double Angles 1,https://isaacphysics.org/questions/double_angle1_num,,,N,Maths,4,Geometry,Trigonometry,,,1,N,N,Y,N,N,N,N,"Trigonometric Relationships, Trigonometric Sums",,
Double Angles 2,https://isaacphysics.org/questions/double_angled2_multi,,,N,Maths,4,Geometry,Trigonometry,,,1,N,Y,N,N,N,N,N,"Trigonometric Relationships, Trigonometric Sums",Cooling Spheres,
Half Angles 1,https://isaacphysics.org/questions/half_angle1_multi,,,N,Maths,4,Geometry,Trigonometry,,,3,N,Y,N,N,N,N,N,"Trigonometric Relationships, Trigonometric Sums",,
Block on a Slope,https://isaacphysics.org/questions/block_on_slope_num,,,N,Maths,2,Geometry,Vectors,,,3,N,N,Y,N,N,N,N,"Vectors - Describing and Adding Vectors, Vectors - Resolving Vectors","Autoignition, Fireworks!, Helium Balloon, LHC Maintenance, Mixture of Gases, Van der Waals Gas",
Position of Boat,https://isaacphysics.org/questions/boat_position,,,N,Maths,2,Geometry,Vectors,,,2,N,N,Y,N,N,N,N,"Vectors - Describing and Adding Vectors, Vectors - Resolving Vectors","Autoignition, Fireworks!, Gas Sphere, Helium Balloon, LHC Maintenance, Van der Waals Gas",
Crossing Paths,https://isaacphysics.org/questions/crossing_paths,,,N,Maths,2,Geometry,Vectors,,,2,N,N,Y,N,N,N,N,"Vectors - Describing and Adding Vectors, Vectors - Resolving Vectors","A Stone's Flight, Into the Sea",
Ferry and Current,https://isaacphysics.org/questions/ferry_current,,,N,Maths,2,Geometry,Vectors,,,2,N,N,Y,N,N,N,N,"Vectors - Describing and Adding Vectors, Vectors - Resolving Vectors","Coming to Rest, The Collision Condition",
Forces in Equilibrium,https://isaacphysics.org/questions/forces_equilibrium,,,N,Maths,2,Geometry,Vectors,,,2,N,N,Y,N,N,N,N,"Vectors - Describing and Adding Vectors, Vectors - Resolving Vectors","A Stoplight, Coming to Rest",
A Unit Vector in 2D,https://isaacphysics.org/questions/unit_vector_multi,,,N,Maths,2,Geometry,Vectors,,,1,N,Y,N,N,N,N,N,"Vectors - Describing and Adding Vectors, Vectors - Resolving Vectors","The Collision Condition, The Collision Condition, The Equations of Motion, The Equations of Motion",
Vector Notation in 3D,https://isaacphysics.org/questions/vector_notation1,,,N,Maths,2,Geometry,Vectors,,,1,N,Y,N,N,N,N,N,"Vectors - Describing and Adding Vectors, Vectors - Resolving Vectors",,
Manipulating Vectors in 2D,https://isaacphysics.org/questions/vector_notation2,,,N,Maths,2,Geometry,Vectors,,,5,N,N,Y,N,N,N,N,"Vectors - Describing and Adding Vectors, Vectors - Resolving Vectors",,
Projecting Vectors in 2D,https://isaacphysics.org/questions/vector_notation3,,,N,Maths,2,Geometry,Vectors,,,3,Y,N,Y,N,N,N,N,"Vectors - Describing and Adding Vectors, Vectors - Resolving Vectors","A Strange Planet, Braking a Car, Highway Pursuit",
Manipulating Vectors in 3D,https://isaacphysics.org/questions/vector_notation4_num,,,N,Maths,2,Geometry,Vectors,,,3,N,N,Y,N,N,N,N,"Vectors - Describing and Adding Vectors, Vectors - Resolving Vectors","A Strange Planet, Braking a Car, Highway Pursuit",
A Projectile using Vectors,https://isaacphysics.org/questions/vectors_projectile_num,,,N,Maths,2,Geometry,Vectors,,,2,N,N,Y,N,N,N,N,"Vectors - Describing and Adding Vectors, Vectors - Resolving Vectors","Stop the Train, Vectors Versus Scalars: A Train",
Vectors and Triangles 1,https://isaacphysics.org/questions/vectors_triangles1_multi,,,N,Maths,2,Geometry,Vectors,,,4,N,Y,Y,N,N,N,N,"Vectors - Describing and Adding Vectors, Vectors - Resolving Vectors","Stop the Train, Vectors Versus Scalars: A Train",
Vectors and Triangles 2,https://isaacphysics.org/questions/vectors_triangles2_multi,,,N,Maths,2,Geometry,Vectors,,,3,N,Y,Y,N,N,N,N,"Vectors - Describing and Adding Vectors, Vectors - Resolving Vectors","A Bomb and a Ship's Funnel, A Strange Planet",
Angle between Vectors 1,https://isaacphysics.org/questions/angle_between_vectors1,,,N,Maths,5,Geometry,Vectors,,,1,N,N,Y,N,N,N,N,"Vectors - Describing and Adding Vectors, Vectors - Resolving Vectors","A Bomb and a Ship's Funnel, A Strange Planet",
Angle between Vectors 2,https://isaacphysics.org/questions/angle_between_vectors2,,,N,Maths,5,Geometry,Vectors,,,1,N,N,Y,N,N,N,N,"Vectors - Describing and Adding Vectors, Vectors - Resolving Vectors","A Ball Thrown Off a Cliff , Bouncing a Ball across a Half-Pipe, The Ant and the Tortoise, The Collision Condition",
Scalar Product 1,https://isaacphysics.org/questions/dot_product1,,,N,Maths,5,Geometry,Vectors,,,1,N,N,Y,N,N,N,N,"Vectors - Describing and Adding Vectors, Vectors - Resolving Vectors","Building a Tennis Court, Jumping over a Log, Maximum Angle Throw, Reaching a Sloping Roof",
Scalar Product 2,https://isaacphysics.org/questions/dot_product2,,,N,Maths,5,Geometry,Vectors,,,1,N,N,Y,N,N,N,N,"Vectors - Describing and Adding Vectors, Vectors - Resolving Vectors","Maximum Angle Throw, Shooting a Balloon, Throwing a Ball up a Flat Slope",
Scalar Product 3,https://isaacphysics.org/questions/dot_product3,,,N,Maths,5,Geometry,Vectors,,,2,N,N,N,Y,Y,N,N,"Vectors - Describing and Adding Vectors, Vectors - Resolving Vectors (Dot Product)","A Search Spiral, Love Bugs, The Ant and the Tortoise",
Scalar Product 3,https://isaacphysics.org/questions/dot_product3_multi,,,N,Maths,5,Geometry,Vectors,,,1,N,Y,N,N,N,N,N,"Vectors - Describing and Adding Vectors, Vectors - Resolving Vectors","Angle of a Chip in Golf, Maximum Angle Throw, Shooting a Balloon",
Scalar Product 4,https://isaacphysics.org/questions/dot_product4_multi,,,N,Maths,5,Geometry,Vectors,,,1,N,Y,N,N,N,N,N,"Vectors - Describing and Adding Vectors, Vectors - Resolving Vectors","Mercury in a U-Tube, Modelling Earth's Gravity, Star in a Galaxy",
Scalar Product 4,https://isaacphysics.org/questions/dot_product4_new,,,N,Maths,5,Geometry,Vectors,,,2,N,Y,N,Y,Y,N,N,"Geometry - Angles and Triangles, Vectors - Describing and Adding Vectors, Vectors - Resolving Vectors (Dot Product)","A Hailstorm, Superball",
Rate of doing Work,https://isaacphysics.org/questions/rate_of_work,,,N,Maths,5,Geometry,Vectors,,,1,N,N,Y,N,N,N,N,"Vectors - Describing and Adding Vectors, Vectors - Resolving Vectors","A Ball Thrown Off a Cliff , Falling Masses, Into the Sea, Pulleys on a Table",
Work Done by a Force 1,https://isaacphysics.org/questions/work_done1,,,N,Maths,5,Geometry,Vectors,,,2,N,N,Y,N,N,N,N,"Vectors - Describing and Adding Vectors, Vectors - Resolving Vectors","Stop the Train, Vectors Versus Scalars: A Train",
Work Done by a Force 2,https://isaacphysics.org/questions/work_done2,,,N,Maths,5,Geometry,Vectors,,,3,N,N,N,Y,Y,N,N,"Vectors - Describing and Adding Vectors, Vectors - Resolving Vectors (Dot Product)","Olympic Sprinter, Pulleys on a Table",
Work Done by a Force 2,https://isaacphysics.org/questions/work_done2_num,,,N,Maths,5,Geometry,Vectors,,,2,N,N,Y,N,N,N,N,"Vectors - Describing and Adding Vectors, Vectors - Resolving Vectors","Olympic Sprinter, Pulleys on a Table",
Work Done by a Force 3,https://isaacphysics.org/questions/work_done3,,,N,Maths,5,Geometry,Vectors,,,3,N,N,Y,Y,Y,N,N,"Vectors - Describing and Adding Vectors, Vectors - Resolving Vectors (Dot Product)","A Coiled Rope, Braking a Car, On Ice, Two Particles on a String, Two Particles on a String",
Charges in Magnetic Fields 1,https://isaacphysics.org/questions/charges_in_B_fields1,,,N,Maths,6,Geometry,Vectors,,,4,N,Y,N,Y,Y,N,N,Vectors - Vector Products,"A Coiled Rope, Braking a Car, On Ice, Two Particles on a String",
Charges in Magnetic Fields 2,https://isaacphysics.org/questions/charges_in_B_fields2,,,N,Maths,6,Geometry,Vectors,,,4,N,Y,Y,N,Y,N,N,Vectors - Vector Products,"Cracking Eggs, Stop the Train",
Currents in Magnetic Fields,https://isaacphysics.org/questions/currents_in_B_fields,,,N,Maths,6,Geometry,Vectors,,,8,N,Y,Y,Y,Y,N,N,Vectors - Vector Products,"A Well, On Ice",
Rotational Motion 1,https://isaacphysics.org/questions/rotational_motion1,,,N,Maths,6,Geometry,Vectors,,,3,N,N,Y,N,Y,N,N,Vectors - Vector Products (Rotational motion),"Pulleys on a Table, Sprinter Running 100m",
Rotational Motion 2,https://isaacphysics.org/questions/rotational_motion2,,,N,Maths,6,Geometry,Vectors,,,5,N,N,Y,Y,Y,N,N,"Vectors - Vector Products, Vectors - Resolving Vectors (Dot Product)","A Search Spiral, Building a Tennis Court",
Torques 1,https://isaacphysics.org/questions/torques_1,,,N,Maths,6,Geometry,Vectors,,,5,N,Y,Y,Y,Y,N,N,Vectors - Vector Products,"Angle of a Chip in Golf, Jumping over a Log",
Torques 2,https://isaacphysics.org/questions/torques_2,,,N,Maths,6,Geometry,Vectors,,,2,N,Y,N,Y,Y,N,N,Vectors - Vector Products,"Mass on a Horizontal Spring, Rods, Rings and Strings, Transfer of Energy in Collisions",
Vector Area,https://isaacphysics.org/questions/vector_area,,,N,Maths,6,Geometry,Vectors,,,8,N,N,Y,Y,Y,N,N,Vectors - Vector Products (Area),Highway Pursuit,
Vector Products 1,https://isaacphysics.org/questions/vector_products1,,,N,Maths,6,Geometry,Vectors,,,7,N,Y,N,Y,Y,N,N,Vector products in Cartesian coordinates,"Falling Chain, The Lifeguard ",
Vector Products 2,https://isaacphysics.org/questions/vector_products2,,,N,Maths,6,Geometry,Vectors,,,6,N,N,N,Y,Y,N,N,Vector products in Cartesian coordinates,"The Collision Condition, Will They Collide?",
1. Logarithms,https://isaacphysics.org/questions/ft_lower_1,,,Y,Maths,1,,,,,3,Y,Y,Y,N,Y,N,N,,"An Accident, Falling Balls, Powerful Stuff, Rapid Acceleration",
10. Quadratic Equations,https://isaacphysics.org/questions/ft_lower_10,,,Y,Maths,1,,,,,2,N,N,Y,N,N,N,N,,"A Sliding Stone, The Equations of Motion",
11. Cubic Polynomials 1,https://isaacphysics.org/questions/ft_lower_11,,,Y,Maths,1,,,,,2,N,N,Y,N,Y,N,N,,Triangular Flying Course,
12. Cubic Polynomials 2,https://isaacphysics.org/questions/ft_lower_12,,,Y,Maths,1,,,,,2,N,N,Y,N,Y,N,N,,"Freefall to the Moon, Freefall to the Moon, Kepler's Third Law, Simple Transfer Orbit",
13. Curve Sketching,https://isaacphysics.org/questions/ft_lower_13,,,Y,Maths,1,,,,,3,Y,Y,N,N,Y,N,N,,"Mass Resting on a Spring, Maximum Speed in SHM, Rolling Sphere vs. Cylinder, Shooting a Balloon",
14. Simultaneous Equations,https://isaacphysics.org/questions/ft_lower_14,,,Y,Maths,1,,,,,1,N,Y,N,N,N,N,N,,"Ball Dropped onto Spring, Different Spring Circuit, Rods, Rings and Strings, Similar Spring Circuit, Spinning Bungee",
15. Using Coefficients,https://isaacphysics.org/questions/ft_lower_15,,,Y,Maths,1,,,,,1,N,Y,N,N,N,N,N,,"A Diatomic Molecule, Different Spring Circuit, Different Spring Circuit, Geostationary Orbit",
16. Transforming Curves 1,https://isaacphysics.org/questions/ft_lower_16,,,Y,Maths,1,,,,,2,Y,N,N,N,N,N,N,,"A Ballistic Pendulum, A Coiled Rope, On Ice, Two Particles on a String, Two Particles on a String",
17. Transforming Curves 2,https://isaacphysics.org/questions/ft_lower_17,,,Y,Maths,1,,,,,3,Y,Y,N,N,N,N,N,,"Energy of a Bullet, Head-on Collision, The Javelin Thrower, Two Particles on a String",
18. More Polynomials,https://isaacphysics.org/questions/ft_lower_18,,,Y,Maths,1,,,,,2,N,Y,Y,N,N,N,N,,"Energy of a Bullet, The Lift",
19. Tangent to a Curve,https://isaacphysics.org/questions/ft_lower_19,,,Y,Maths,1,,,,,4,Y,Y,N,N,N,N,N,,The Equations of Motion,
2. Simplifying Indices,https://isaacphysics.org/questions/ft_lower_2,,,Y,Maths,1,,,,,5,N,Y,Y,N,N,N,N,," A Toboggan, A Well",
20. A Triangle,https://isaacphysics.org/questions/ft_lower_20,,,Y,Maths,1,,,,,3,N,N,Y,N,N,N,N,,"A Stoplight, Coming to Rest, Stopping Distances, The Equations of Motion",
21. Trigonometric Functions,https://isaacphysics.org/questions/ft_lower_21,,,Y,Maths,1,,,,,3,Y,N,Y,N,N,N,N,,"Cracking Eggs, Stop the Train",
22. Trig Identities 1,https://isaacphysics.org/questions/ft_lower_22,,,Y,Maths,1,,,,,2,Y,N,Y,N,N,N,N,,"Firing a Cannonball, Target Practice, What Goes Up...",
23. Trig Identities 2,https://isaacphysics.org/questions/ft_lower_23,,,Y,Maths,1,,,,,2,Y,N,Y,N,N,N,N,,"Crossing a River, Highway Pursuit",
24. Trig Equations,https://isaacphysics.org/questions/ft_lower_24,,,Y,Maths,1,,,,,2,N,N,Y,N,N,N,N,,"Relative Velocity, The Harbour Entrance, Thrown off a Cliff",
25. Trigonometry,https://isaacphysics.org/questions/ft_lower_25,,,Y,Maths,1,,,,,3,N,Y,N,N,N,N,N,,"The Bouncing Ball, The Michelson-Morley Experiment",
26. Sector of a Circle,https://isaacphysics.org/questions/ft_lower_26,,,Y,Maths,1,,,,,3,N,N,Y,N,N,N,N,,"A Search Spiral, Catching Smugglers, The Ant and the Tortoise",
27. Equation of a Circle,https://isaacphysics.org/questions/ft_lower_27,,,Y,Maths,1,,,,,2,N,Y,Y,N,N,N,N,,,
28. Trig Identities 3,https://isaacphysics.org/questions/ft_lower_28,,,Y,Maths,1,,,,,2,Y,N,Y,N,N,N,N,,"Crossing a River, Light Clock, Triangular Flying Course",
36. An Enclosure,https://isaacphysics.org/questions/ft_lower_29,,,Y,Maths,1,,,,,2,Y,N,Y,N,N,N,N,,"Force of a Bouncing Ball, The Ant and the Tortoise",
29. Derivatives,https://isaacphysics.org/questions/ft_lower_29_new,,,Y,Maths,1,,,,,8,Y,Y,Y,N,N,N,N,,"A Ball Thrown Off a Cliff , Broken Cannon, Into the Sea",
3. Expanding Brackets,https://isaacphysics.org/questions/ft_lower_3,,,Y,Maths,1,,,,,2,N,Y,Y,N,Y,N,N,,"A Bomb and a Ship's Funnel, Building a Tennis Court, Shooting a Balloon",
30. Area Under a Curve,https://isaacphysics.org/questions/ft_lower_30,,,Y,Maths,1,,,,,4,Y,N,Y,N,N,N,N,,Jumping over a Log,
31. Integration,https://isaacphysics.org/questions/ft_lower_31,,,Y,Maths,1,,,,,3,N,Y,Y,N,N,N,N,,"A Ball Thrown Off a Cliff , Broken Cannon, Into the Sea, The Equations of Motion",
32. A Sequence,https://isaacphysics.org/questions/ft_lower_32,,,Y,Maths,1,,,,,3,N,N,Y,N,N,N,N,,"A Ball Thrown Off a Cliff , Broken Cannon, Into the Sea, The Equations of Motion",
33. An Arithmetic Progression,https://isaacphysics.org/questions/ft_lower_33,,,Y,Maths,1,,,,,3,N,N,Y,N,N,N,N,,"A Ball Thrown Off a Cliff , Broken Cannon, Building a Tennis Court, Thrown off a Cliff",
34. A Geometric Progression,https://isaacphysics.org/questions/ft_lower_34,,,Y,Maths,1,,,,,3,N,N,Y,N,N,N,N,,"A Ball Thrown Off a Cliff , Into the Sea",
35. A Binomial Expansion,https://isaacphysics.org/questions/ft_lower_35,,,Y,Maths,1,,,,,4,N,N,Y,N,N,N,N,,"A Stone's Flight, Into the Sea",
37. Trapezium Rule,https://isaacphysics.org/questions/ft_lower_37,,,Y,Maths,1,,,,,3,Y,N,Y,N,Y,N,N,,"A Sliding Stone, The Equations of Motion",
38. Gradient of the Curve,https://isaacphysics.org/questions/ft_lower_38,,,Y,Maths,1,,,,,2,N,Y,Y,N,N,N,N,,"A Stoplight, Coming to Rest",
4. Surds,https://isaacphysics.org/questions/ft_lower_4,,,Y,Maths,1,,,,,2,N,Y,N,N,N,N,N,,,
5. Simplifying Algebraic Expressions,https://isaacphysics.org/questions/ft_lower_5,,,Y,Maths,1,,,,,3,N,Y,N,N,N,N,N,,"A Jet in the Fog, A Polar Bear Heading North, Triangular Flying Course",
6. Lines,https://isaacphysics.org/questions/ft_lower_6,,,Y,Maths,1,,,,,3,Y,Y,Y,N,N,N,N,,"A Polar Bear Heading North, Relative Velocity, Shooting a Balloon, Swimming to a Boat",
7. Gradients,https://isaacphysics.org/questions/ft_lower_7,,,Y,Maths,1,,,,,2,N,N,Y,N,N,N,N,,"Bead on a Wire, Festival Banner, Hanging a Non-uniform Bar, Pegs and String",
8. Normal to a Curve,https://isaacphysics.org/questions/ft_lower_8,,,Y,Maths,1,,,,,3,N,N,Y,N,N,N,N,,"A Hinged Rod, Rod and Circle, Rope between Inclines, Three Spheres, Two Rods and a Hinge",
9. Line Segments,https://isaacphysics.org/questions/ft_lower_9,,,Y,Maths,1,,,,,3,N,Y,Y,N,N,N,N,,"A Uniform Ladder, Pyramid of Spheres, Three Cylinders, Three Spheres, Two Spheres",
1. Logarithms and Exponentials,https://isaacphysics.org/questions/ft_upper_1,,,Y,Maths,2,,,,,2,N,Y,Y,N,Y,N,N,,"A Uniform Ladder, A Uniform Ladder, Bismar Scales, Lamina on a Table, Lamina on a Table, Leaning Ladder, Toppling Block, Two Rods and a Hinge",
10. Inequalities,https://isaacphysics.org/questions/ft_upper_10,,,Y,Maths,2,,,,,3,Y,Y,N,N,Y,N,N,,"A Uniform Ladder, Bismar Scales, Lamina on a Table, Leaning Ladder, Toppling Block, Two Rods and a Hinge",
11. Factorising,https://isaacphysics.org/questions/ft_upper_11,,,Y,Maths,2,,,,,2,N,Y,Y,N,Y,N,N,,"A Hinged Rod, A Uniform Ladder, Block on a Rough Table, Double Decker Bus, Lamina on a Table, Leaning Ladder, Two Rods and a Hinge, Weight of a Lorry",
12. Roots and Factors,https://isaacphysics.org/questions/ft_upper_12,,,Y,Maths,2,,,,,3,N,Y,Y,N,Y,N,N,,"Pulling out a Nail, Towel on a Washing Line",
13. Finding Roots,https://isaacphysics.org/questions/ft_upper_13,,,Y,Maths,2,,,,,1,N,N,Y,N,Y,N,N,,"A Hinged Rod, A Uniform Ladder, Leaning Ladder, Thinking about Friction",
14. Simultaneous Equations,https://isaacphysics.org/questions/ft_upper_14,,,Y,Maths,2,,,,,5,Y,Y,Y,N,N,N,N,,Ball Suspended by a Thread,
15. Completing the Square,https://isaacphysics.org/questions/ft_upper_15,,,Y,Maths,2,,,,,3,Y,Y,N,N,N,N,N,,"Ball Suspended by a Thread, Different Spring Circuit",
16. Curve sketching,https://isaacphysics.org/questions/ft_upper_16,,,Y,Maths,2,,,,,4,Y,Y,Y,N,N,N,N,,"Pegs and String, Three Cylinders, Two Rods and a Hinge, Two Spheres",
